listing_link,searched_location,title_bed_bats_review,price_per_night,review_count,review_count_link,host_link,host_response_rate,listing_description,cleanliness_ratings,accuracy_ratings,check-in_ratings,communication_ratings,location_ratings,value_ratings,google_map_location_link,facilities
https://www.airbnb.com/rooms/1166085964383269116?adults=1&category_tag=Tag%3A8678&children=0&enable_m3_private_room=true&infants=0&pets=0&photo_id=1916850550&search_mode=regular_search&check_in=2024-06-13&check_out=2024-06-18&source_impression_id=p3_1718223643_P3j5fb00O7CigF2C&previous_page_section_name=1000&federated_search_id=6a9bb93c-dc81-4776-96a0-85723c68c0e3,Segunbagicha,Bed and breakfast in ঢাকা · ★New · 1 bedroom · 1 private bath,$74 ,,,https://www.airbnb.com/users/show/576349395,,"located 3 km away from the bustling Bashundhara shopping mall, 4 km away from Lalbag Fort and just 2 km away from Dhaka University. Hazrat Shahjalal International Airport is 10 km away and Kamlapur Railway station is 2 km away from the property.

The hotel offers travellers car rental and currency exchange facilities. Assistance can be sought at the tour desk or with the concierge. Guests can also pamper themselves in the resident salon or massage centre or work out in the fitness centre.",,,,,,,"https://maps.google.com/maps?ll=23.735741,90.410959&z=14&t=m&hl=en&gl=BD&mapclient=apiv3","['Hair dryer', 'Outdoor shower', 'Washer', 'Iron', 'TV', 'Exercise equipment', 'Pool table', 'Crib', 'Air conditioning', 'Indoor fireplace', 'Heating', 'Lock on bedroom door', 'Noise decibel monitors on property', 'Smoke alarm', 'Carbon monoxide alarm', 'Fire extinguisher', 'First aid kit', 'Wifi', 'Dedicated workspace', 'Kitchen', 'Cooking basics', 'Beach access – Beachfront', 'Lake access', 'Fire pit', 'Outdoor dining area', 'BBQ grill', 'Free parking on premises', 'Pool', 'Hot tub', 'Paid parking on premises', 'Pets allowed', 'Self check-in', 'Building staff', 'Unavailable: Exterior security cameras on property\nExterior security cameras on property', 'Unavailable: Dryer\nDryer', 'Unavailable: Essentials\nEssentials', 'Unavailable: Hot water\nHot water']"
https://www.airbnb.com/rooms/699711279837365753?adults=1&children=0&enable_m3_private_room=true&infants=0&pets=0&search_mode=regular_search&check_in=2024-06-13&check_out=2024-06-18&source_impression_id=p3_1718223648_P3AfrDo82-dRInRH&previous_page_section_name=1000&federated_search_id=4b69a554-851f-4f73-8b62-01cbda64617d,Segunbagicha,Serviced apartment in Dhaka · ★3.92 · 1 bedroom · 2 beds · 1 bath,$55 ,12 reviews,https://www.airbnb.com/rooms/699711279837365753/reviews?adults=1&children=0&enable_m3_private_room=true&infants=0&pets=0&search_mode=regular_search&check_in=2024-06-13&check_out=2024-06-18&source_impression_id=p3_1718223648_P3AfrDo82-dRInRH&previous_page_section_name=1000&federated_search_id=4b69a554-851f-4f73-8b62-01cbda64617d,https://www.airbnb.com/users/show/120995237,Response rate: 100%,,3.9,3.9,4.4,4.0,3.8,3.8,"https://maps.google.com/maps?ll=23.73293,90.41791&z=14&t=m&hl=en&gl=BD&mapclient=apiv3","['City skyline view', 'Courtyard view', 'Garden view', 'Park view', 'Pool view', 'Hair dryer', 'Cleaning products', 'Shampoo', 'Body soap', 'Outdoor shower', 'Hot water', 'Paid washer – In building', 'Essentials', 'Hangers', 'Bed linens', 'Extra pillows and blankets', 'Room-darkening shades', 'Iron', 'Drying rack for clothing', 'Safe', 'Mosquito net', 'Clothing storage: walk-in closet, closet, wardrobe, and dresser', '43 inch HDTV with Amazon Prime Video, Chromecast, Disney+, Fire TV, HBO Max, Netflix, premium cable, Roku, standard cable', 'Exercise equipment: elliptical, free weights, stationary bike, treadmill, yoga mat, workout bench, rowing', 'Books and reading material', 'Movie theater', 'Paid crib - available upon request', 'Paid pack ’n play/travel crib - available upon request', 'Children’s books and toys for ages 0-2 years old, 2-5 years old, 5-10 years old, and 10+ years old', 'Paid standalone high chair - available upon request', 'Children’s dinnerware', 'Changing table - available upon request', 'Window guards', ""Children's playroom"", 'Outdoor playground', 'AC - split type ductless system', 'Ceiling fan', 'Heating - split type ductless system', 'Fire extinguisher', 'First aid kit', 'Wifi', 'Dedicated workspace', 'Kitchen', 'Sharp refrigerator', 'Microwave', 'Cooking basics', 'Dishes and silverware', 'Mini fridge', 'Freezer', 'Infrared burner stove', 'Stainless steel single oven', 'Hot water kettle', 'Coffee maker: drip coffee maker, espresso machine, french press, Keurig coffee machine, Nespresso, pour-over coffee', 'Wine glasses', 'Toaster', 'Blender', 'Barbecue utensils', 'Dining table', 'Coffee', 'Waterfront', 'Private entrance', 'Laundromat nearby', 'Private patio or balcony', 'Private backyard – Fully fenced', 'Outdoor furniture', 'Outdoor dining area', 'Outdoor kitchen with sink, oven', 'Private BBQ grill: charcoal, electric, gas, wood-burning', 'Sun loungers', 'Free parking on premises', 'Free street parking', 'Private outdoor pool - available all year, open specific hours, heated, infinity, lap pool, rooftop', 'Private sauna', 'Elevator', 'Private gym in building', 'Paid parking garage on premises – 40 spaces', 'Pets allowed', 'Luggage dropoff allowed', 'Smoking allowed', 'Long term stays allowed', 'Self check-in', 'Building staff', 'Cleaning available during stay', 'Unavailable: Exterior security cameras on property\nExterior security cameras on property', 'Unavailable: Dryer\nDryer', 'Unavailable: Smoke alarm\nSmoke alarm', 'Unavailable: Carbon monoxide alarm\nCarbon monoxide alarm']"
https://www.airbnb.com/rooms/957017223859080444?adults=1&children=0&enable_m3_private_room=true&infants=0&pets=0&search_mode=regular_search&check_in=2024-06-14&check_out=2024-06-19&source_impression_id=p3_1718223653_P3EbEcbUsPIIM5B7&previous_page_section_name=1000&federated_search_id=6dbbcca5-c58b-46b8-a3a8-eff2660d0fdf,Segunbagicha,Serviced apartment in Dhaka · 3 bedrooms · 3 baths,$34 ,,,https://www.airbnb.com/users/show/516454397,Response rate: 100%,,,,,,,,"https://maps.google.com/maps?ll=23.7358,90.4145&z=14&t=m&hl=en&gl=BD&mapclient=apiv3","['City skyline view', 'Bathtub', 'Cleaning products', 'Hot water', 'Washer', 'Iron', 'Clothing storage: closet, wardrobe, and dresser', 'TV', 'Window guards', 'Air conditioning', 'Ceiling fan', 'Smoke alarm', 'Carbon monoxide alarm', 'Fire extinguisher', 'First aid kit', 'Wifi', 'Dedicated workspace', 'Kitchen', 'Refrigerator', 'Microwave', 'Cooking basics', 'Dishes and silverware', 'Mini fridge', 'Stove', 'Hot water kettle', 'Trash compactor', 'Dining table', 'Elevator', 'Paid parking garage on premises – 10 spaces', 'Pets allowed', 'Luggage dropoff allowed', 'Smoking allowed', 'Long term stays allowed', 'Self check-in', 'Building staff', 'Unavailable: Exterior security cameras on property\nExterior security cameras on property', 'Unavailable: Dryer\nDryer', 'Unavailable: Essentials\nEssentials', 'Unavailable: Heating\nHeating']"
https://www.airbnb.com/rooms/1125428422306900772?adults=1&category_tag=Tag%3A8678&children=0&enable_m3_private_room=true&infants=0&pets=0&photo_id=1873863592&search_mode=regular_search&check_in=2024-06-14&check_out=2024-06-19&source_impression_id=p3_1718223658_P3yQlfsUa_bG10rK&previous_page_section_name=1000&federated_search_id=591de669-6026-43aa-b4ef-ed8badf16353,Segunbagicha,Rental unit in Dhaka · ★New · 1 bedroom · 1 bed,$9 ,,,https://www.airbnb.com/users/show/569092644,,"it is a good looking and save and silent for sleep. and it is middle of dhaka, bangladesh",,,,,,,"https://maps.google.com/maps?ll=23.7144,90.4017&z=14&t=m&hl=en&gl=BD&mapclient=apiv3","['TV', 'Air conditioning', 'Lock on bedroom door', 'Kitchen', 'Unavailable: Exterior security cameras on property\nExterior security cameras on property', 'Unavailable: Wifi\nWifi', 'Unavailable: Washer\nWasher', 'Unavailable: Dryer\nDryer', 'Unavailable: Essentials\nEssentials', 'Unavailable: Smoke alarm\nSmoke alarm', 'Unavailable: Carbon monoxide alarm\nCarbon monoxide alarm', 'Unavailable: Heating\nHeating', 'Unavailable: Hot water\nHot water']"
https://www.airbnb.com/rooms/1137795677887554757?adults=1&category_tag=Tag%3A8678&children=0&enable_m3_private_room=true&infants=0&pets=0&photo_id=1887148743&search_mode=regular_search&check_in=2024-06-14&check_out=2024-06-19&source_impression_id=p3_1718223660_P3AxNOwL2ryA6SqF&previous_page_section_name=1000&federated_search_id=e5abe21b-8fc1-4988-9482-df70bee3fc99,Segunbagicha,Rental unit in Dhaka · ★New · 1 bedroom · 1 bed · 1 bath,$21 ,,,https://www.airbnb.com/users/show/144153539,,Take a break and unwind at this peaceful oasis.,,,,,,,"https://maps.google.com/maps?ll=23.734458,90.385685&z=14&t=m&hl=en&gl=BD&mapclient=apiv3","['TV', 'Air conditioning', 'Lock on bedroom door', 'Wifi', 'Kitchen', 'Hot tub', 'Paid parking on premises', 'Unavailable: Exterior security cameras on property\nExterior security cameras on property', 'Unavailable: Washer\nWasher', 'Unavailable: Dryer\nDryer', 'Unavailable: Essentials\nEssentials', 'Unavailable: Smoke alarm\nSmoke alarm', 'Unavailable: Carbon monoxide alarm\nCarbon monoxide alarm', 'Unavailable: Heating\nHeating', 'Unavailable: Hot water\nHot water']"
