listing_link,searched_location,title_bed_bats_review,price_per_night,review_count,review_count_link,host_link,host_response_rate,listing_description,cleanliness_ratings,accuracy_ratings,check-in_ratings,communication_ratings,location_ratings,value_ratings,google_map_location_link,facilities
https://www.airbnb.com/rooms/1035317758919667042?adults=1&children=0&enable_m3_private_room=true&infants=0&pets=0&search_mode=regular_search&check_in=2024-06-20&check_out=2024-06-25&source_impression_id=p3_1718222992_P3Qq8dEXWaLwb6H-&previous_page_section_name=1000&federated_search_id=e3bd83e9-2fc7-4658-9caa-c8d17046ccc7,Uttara,Rental unit in Dhaka · 2 bedrooms · 2 beds · 3.5 baths,,,,https://www.airbnb.com/users/show/548657917,,"Experience the allure of a captivating 2-bed flat in Uttara Sector 6! This fully furnished facility boasts contemporary amenities, setting the stage for an ideal retreat during your family holiday in Dhaka.

Key Features:
🏡 1st-Floor Flat, perfect for Small Family
🛏️ 2 furnished Bedrooms with attached baths
🛋️ Spacious Sitting Room & Dining Area
🍳 Modern Kitchen
🏡 Fully Furnished - Beds, Sofa, TV, Dining Table, Crockery, and More!
❄️ Fitted Air-Conditioners, Fridge, Freezer, Electric Water Heaters",,,,,,,"https://maps.google.com/maps?ll=23.86728,90.39122&z=14&t=m&hl=en&gl=BD&mapclient=apiv3","['Washer', 'TV', 'Air conditioning', 'Exterior security cameras on property', 'Fire extinguisher', 'Wifi', 'Kitchen', 'Free parking on premises', 'Smoking allowed', 'Self check-in', 'Building staff', 'Unavailable: Dryer\nDryer', 'Unavailable: Essentials\nEssentials', 'Unavailable: Smoke alarm\nSmoke alarm', 'Unavailable: Carbon monoxide alarm\nCarbon monoxide alarm', 'Unavailable: Heating\nHeating', 'Unavailable: Hot water\nHot water']"
https://www.airbnb.com/rooms/1172316915267082886?adults=1&category_tag=Tag%3A8678&children=0&enable_m3_private_room=true&infants=0&pets=0&photo_id=1923302214&search_mode=regular_search&check_in=2024-06-14&check_out=2024-06-19&source_impression_id=p3_1718222992_P36ebt7c3UFTMNZM&previous_page_section_name=1000&federated_search_id=e3bd83e9-2fc7-4658-9caa-c8d17046ccc7,Uttara,Rental unit in Dhaka · ★New · 1 bedroom · 1 bed · 1 bath,,,,https://www.airbnb.com/users/show/567304439,,Bring the whole family to this great place with lots of room for fun.,,,,,,,"https://maps.google.com/maps?ll=23.8763,90.3886&z=14&t=m&hl=en&gl=BD&mapclient=apiv3","['Air conditioning', 'Lock on bedroom door', 'Exterior security cameras on property', 'Wifi', 'Kitchen', 'Unavailable: TV\nTV', 'Unavailable: Washer\nWasher', 'Unavailable: Dryer\nDryer', 'Unavailable: Essentials\nEssentials', 'Unavailable: Smoke alarm\nSmoke alarm', 'Unavailable: Carbon monoxide alarm\nCarbon monoxide alarm', 'Unavailable: Heating\nHeating', 'Unavailable: Hot water\nHot water']"
https://www.airbnb.com/rooms/249192?adults=1&category_tag=Tag%3A8678&children=0&enable_m3_private_room=true&infants=0&pets=0&photo_id=393090775&search_mode=regular_search&check_in=2024-06-13&check_out=2024-06-18&source_impression_id=p3_1718222992_P3NJXUrlLRYVtkKf&previous_page_section_name=1000&federated_search_id=e3bd83e9-2fc7-4658-9caa-c8d17046ccc7,Uttara,Rental unit in Dhaka · ★4.62 · 1 bedroom · 1 bed · 1 shared bath,$13 ,37 reviews,https://www.airbnb.com/rooms/249192/reviews?adults=1&category_tag=Tag%3A8678&children=0&enable_m3_private_room=true&infants=0&pets=0&photo_id=393090775&search_mode=regular_search&check_in=2024-06-13&check_out=2024-06-18&source_impression_id=p3_1718222992_P3NJXUrlLRYVtkKf&previous_page_section_name=1000&federated_search_id=e3bd83e9-2fc7-4658-9caa-c8d17046ccc7,https://www.airbnb.com/users/show/1305631,,,4.5,4.7,4.7,4.8,4.5,4.7,"https://maps.google.com/maps?ll=23.8753,90.3834&z=14&t=m&hl=en&gl=BD&mapclient=apiv3","['Shampoo', 'Essentials', 'Hangers', 'Bed linens', 'Lock on bedroom door', 'First aid kit', 'Wifi', 'Kitchen', 'Refrigerator', 'Cooking basics', 'Dishes and silverware', 'Stove', 'Private entrance', 'Free parking on premises', 'Free street parking', 'Elevator', 'Smoking allowed', 'Long term stays allowed', 'Self check-in', 'Building staff', 'Unavailable: TV\nTV', 'Unavailable: Washer\nWasher', 'Unavailable: Dryer\nDryer', 'Unavailable: Air conditioning\nAir conditioning', 'Unavailable: Smoke alarm\nSmoke alarm', 'Unavailable: Carbon monoxide alarm\nCarbon monoxide alarm', 'Unavailable: Heating\nHeating', 'Unavailable: Hot water\nHot water']"
https://www.airbnb.com/rooms/738754165535037510?adults=1&category_tag=Tag%3A8678&children=0&enable_m3_private_room=true&infants=0&pets=0&photo_id=1509112694&search_mode=regular_search&check_in=2024-06-13&check_out=2024-06-18&source_impression_id=p3_1718222994_P303CaY7XmZoylty&previous_page_section_name=1000&federated_search_id=c30410bc-3e14-43cd-af4a-6022639da7cf,Uttara,Rental unit in ঢাকা · 1 bedroom · 1 bed · 1 private bath,$20 ,1 review,https://www.airbnb.com/rooms/738754165535037510/reviews?adults=1&category_tag=Tag%3A8678&children=0&enable_m3_private_room=true&infants=0&pets=0&photo_id=1509112694&search_mode=regular_search&check_in=2024-06-13&check_out=2024-06-18&source_impression_id=p3_1718222994_P303CaY7XmZoylty&previous_page_section_name=1000&federated_search_id=c30410bc-3e14-43cd-af4a-6022639da7cf,https://www.airbnb.com/users/show/71596215,,"Hello!

We welcome you to stay with us at Homely Haven, situated in the perfect residential center of Dhaka. With just about 3KM's from Dhaka International airport, major commercial districts, hospital, bus stand, railway station, park, shopping malls, fine restaurants and many more.

The place comes with modern amenities along with fresh sunlight which is a rare find in Dhaka.

Come live with us while you travel for work or leisure. We are always handy to help you enjoy your stay!

Homely stay!",,,,,,,"https://maps.google.com/maps?ll=23.8727,90.40447&z=14&t=m&hl=en&gl=BD&mapclient=apiv3","['Bathtub', 'Hair dryer', 'Cleaning products', 'Shampoo', 'Body soap', 'Bidet', 'Free dryer – In building', 'Essentials', 'Hangers', 'Bed linens', 'Extra pillows and blankets', 'Room-darkening shades', 'Drying rack for clothing', 'Clothing storage: closet', '50 inch HDTV with Netflix', 'Awei sound system with Bluetooth and aux', 'Books and reading material', 'Movie theater', 'Children’s books and toys', 'High chair', 'AC - split type ductless system', 'Portable heater', 'Lock on bedroom door', 'Fire extinguisher', 'First aid kit', 'Wifi', 'Dedicated workspace', 'Kitchen', 'Samsung refrigerator', 'Microwave', 'Dishes and silverware', 'Freezer', 'Gas stove', 'Oven', 'Toaster', 'Dining table', 'Laundromat nearby', 'Resort access', 'Shared patio or balcony', 'Backyard', 'Free parking on premises', 'Elevator', 'Luggage dropoff allowed', 'Smoking allowed', 'Long term stays allowed', 'Cleaning available during stay', 'Unavailable: Exterior security cameras on property\nExterior security cameras on property', 'Unavailable: Washer\nWasher', 'Unavailable: Smoke alarm\nSmoke alarm', 'Unavailable: Carbon monoxide alarm\nCarbon monoxide alarm', 'Unavailable: Hot water\nHot water']"
https://www.airbnb.com/rooms/830935450699373014?adults=1&children=0&enable_m3_private_room=true&infants=0&pets=0&search_mode=regular_search&check_in=2024-06-14&check_out=2024-06-19&source_impression_id=p3_1718222994_P3Z4K1pcdX4LzPI8&previous_page_section_name=1000&federated_search_id=c30410bc-3e14-43cd-af4a-6022639da7cf,Uttara,Rental unit in Dhaka · 2 bedrooms · 2 baths,$33 ,2 reviews,https://www.airbnb.com/rooms/830935450699373014/reviews?adults=1&children=0&enable_m3_private_room=true&infants=0&pets=0&search_mode=regular_search&check_in=2024-06-14&check_out=2024-06-19&source_impression_id=p3_1718222994_P3Z4K1pcdX4LzPI8&previous_page_section_name=1000&federated_search_id=c30410bc-3e14-43cd-af4a-6022639da7cf,https://www.airbnb.com/users/show/54023764,Response rate: 96%,"Quality comes first, around 40 fully furnished apartments of mine at various locations of Dhaka. This apartment is close to airport can be seen from both balcony & rooftop. This flat is around 1000 sq-ft, 2 bed room fully furnished. Nearby restaurants and dining available, situated at Uttara sector 3. Please read out the full house rules before you send any booking request. There is Lift up to 5 th floor and the apartment itself in 6th floor, so guest have to climb stairs for 1 floor",,,,,,,"https://maps.google.com/maps?ll=23.86296,90.39618&z=14&t=m&hl=en&gl=BD&mapclient=apiv3","['Hot water', 'Free washer – In unit', 'Essentials', 'Hangers', 'Bed linens', 'Room-darkening shades', 'Iron', 'Mosquito net', 'Clothing storage: closet', 'Air conditioning', 'Ceiling fan', 'Wifi', 'Kitchen', 'Refrigerator', 'Microwave', 'Dishes and silverware', 'Gas stove', 'Hot water kettle', 'Blender', 'Trash compactor', 'Dining table', 'Private patio or balcony', 'Free residential garage on premises – 1 space', 'Elevator', 'Long term stays allowed', 'Self check-in', 'Building staff', 'Unavailable: Exterior security cameras on property\nExterior security cameras on property', 'Unavailable: TV\nTV', 'Unavailable: Dryer\nDryer', 'Unavailable: Smoke alarm\nSmoke alarm', 'Unavailable: Carbon monoxide alarm\nCarbon monoxide alarm', 'Unavailable: Heating\nHeating']"
