listing_link,searched_location,title_bed_bats_review,price_per_night,review_count,review_count_link,host_link,host_response_rate,listing_description,cleanliness_ratings,accuracy_ratings,check-in_ratings,communication_ratings,location_ratings,value_ratings,google_map_location_link,facilities
https://www.airbnb.com/rooms/43383422?adults=1&children=0&enable_m3_private_room=true&infants=0&pets=0&search_mode=regular_search&check_in=2024-06-13&check_out=2024-06-18&source_impression_id=p3_1718221043_P3nrAntrR9uAiqMh&previous_page_section_name=1000&federated_search_id=c8e395c8-b426-49e4-ab47-47eb0fe45903,Cox's Bazar,Rental unit in Cox's Bazar · 2 bedrooms · 2 beds · 1 bath,$40 ,,,https://www.airbnb.com/users/show/345646297,Responds within a few days or more,,,,,,,,"https://maps.google.com/maps?ll=21.42328,91.98273&z=14&t=m&hl=en&gl=BD&mapclient=apiv3","['Hair dryer', 'Shampoo', 'Essentials', 'Hangers', 'TV', 'Air conditioning', 'Heating', 'Exterior security cameras on property', 'First aid kit', 'Wifi', 'Kitchen', 'Private entrance', 'Free parking on premises', 'Breakfast', 'Smoking allowed', 'Unavailable: Washer\nWasher', 'Unavailable: Dryer\nDryer', 'Unavailable: Smoke alarm\nSmoke alarm', 'Unavailable: Carbon monoxide alarm\nCarbon monoxide alarm', 'Unavailable: Hot water\nHot water']"
https://www.airbnb.com/rooms/739374365443259043?adults=1&children=0&enable_m3_private_room=true&infants=0&pets=0&search_mode=regular_search&check_in=2024-06-13&check_out=2024-06-18&source_impression_id=p3_1718221043_P3FYxgG-O7YNy0qG&previous_page_section_name=1000&federated_search_id=c8e395c8-b426-49e4-ab47-47eb0fe45903,Cox's Bazar,Vacation home in Cox's Bazar · 3 bedrooms · 3 baths,$132 ,,,https://www.airbnb.com/users/show/483902587,Response rate: 67%,"Enjoy your Holiday Beside Sea Beach, where you can sea open sky and sea as well as mountain together. it's a smart Beach House where you can like your own personal home .",,,,,,,"https://maps.google.com/maps?ll=21.4021,91.9943&z=14&t=m&hl=en&gl=BD&mapclient=apiv3","['Cleaning products', 'Shampoo', 'Body soap', 'Hot water', 'HDTV', 'Children’s books and toys', 'Central air conditioning', 'Exterior security cameras on property', 'Wifi', 'Dedicated workspace', 'Refrigerator', 'Outdoor dining area', 'BBQ grill', 'Smoking allowed', 'Unavailable: Kitchen\nKitchen', 'Unavailable: Washer\nWasher', 'Unavailable: Dryer\nDryer', 'Unavailable: Essentials\nEssentials', 'Unavailable: Smoke alarm\nSmoke alarm', 'Unavailable: Carbon monoxide alarm\nCarbon monoxide alarm', 'Unavailable: Heating\nHeating']"
https://www.airbnb.com/rooms/26901701?adults=1&category_tag=Tag%3A8678&children=0&enable_m3_private_room=true&infants=0&pets=0&photo_id=540071789&search_mode=regular_search&check_in=2024-06-13&check_out=2024-06-18&source_impression_id=p3_1718221043_P3nklj0DRXtytz11&previous_page_section_name=1000&federated_search_id=c8e395c8-b426-49e4-ab47-47eb0fe45903,Cox's Bazar,Guest suite in Cox's Bazar · Studio · 1 shared bath,$120 ,,,https://www.airbnb.com/users/show/202372633,,,,,,,,,"https://maps.google.com/maps?ll=21.42654,91.97591&z=14&t=m&hl=en&gl=BD&mapclient=apiv3","['Shampoo', 'Washer', 'Dryer', 'Essentials', 'Hangers', 'TV', 'Heating', 'Wifi', 'Free parking on premises', 'Pool', 'Private living room', 'Smoking allowed', 'Unavailable: Lock on bedroom door\nLock on bedroom door', 'Unavailable: Kitchen\nKitchen', 'Unavailable: Air conditioning\nAir conditioning', 'Unavailable: Smoke alarm\nSmoke alarm', 'Unavailable: Carbon monoxide alarm\nCarbon monoxide alarm', 'Unavailable: Hot water\nHot water']"
https://www.airbnb.com/rooms/24129990?adults=1&children=0&enable_m3_private_room=true&infants=0&pets=0&search_mode=regular_search&check_in=2024-06-15&check_out=2024-06-20&source_impression_id=p3_1718221043_P31xn1r12gu2Q8V5&previous_page_section_name=1000&federated_search_id=c8e395c8-b426-49e4-ab47-47eb0fe45903,Cox's Bazar,Home in Cox's Bazar · 2 bedrooms · 2 beds · 2 baths,$30 ,,,https://www.airbnb.com/users/show/152864610,,The place surrounded by a number of popular restaurants. It is a quiet and a friendly place. Beach is 10-15 mins away from the house by walk. The renowned Burmese market is also close to the place. This place is ideal for a big group of friends or a family. The place is very convenient for the tourist who loves shopping and transport can be found nearby. Guest will have access to the entire place. Guest will not meet the owner but will find the caretaker there.,,,,,,,"https://maps.google.com/maps?ll=21.44113,91.97136&z=14&t=m&hl=en&gl=BD&mapclient=apiv3","['Essentials', 'Hangers', 'Kitchen', 'Free parking on premises', 'Smoking allowed', 'Unavailable: Wifi\nWifi', 'Unavailable: TV\nTV', 'Unavailable: Washer\nWasher', 'Unavailable: Dryer\nDryer', 'Unavailable: Air conditioning\nAir conditioning', 'Unavailable: Smoke alarm\nSmoke alarm', 'Unavailable: Carbon monoxide alarm\nCarbon monoxide alarm', 'Unavailable: Heating\nHeating', 'Unavailable: Hot water\nHot water']"
https://www.airbnb.com/rooms/47806650?adults=1&category_tag=Tag%3A8678&children=0&enable_m3_private_room=true&infants=0&pets=0&photo_id=1122766119&search_mode=regular_search&check_in=2024-06-13&check_out=2024-06-18&source_impression_id=p3_1718221043_P3ORUgHbRRwriqvt&previous_page_section_name=1000&federated_search_id=c8e395c8-b426-49e4-ab47-47eb0fe45903,Cox's Bazar,Rental unit in Cox's Bazar · 1 bedroom · 2 beds · 1 private bath,$200 ,,,https://www.airbnb.com/users/show/960359,,,,,,,,,"https://maps.google.com/maps?ll=21.44601,91.97554&z=14&t=m&hl=en&gl=BD&mapclient=apiv3","['Shampoo', 'Hot water', 'Washer', 'Essentials', 'Hangers', 'Iron', 'Air conditioning', 'Lock on bedroom door', 'First aid kit', 'Wifi', 'Kitchen', 'Free parking on premises', 'Elevator', 'Gym', 'Pets allowed', 'Smoking allowed', 'Unavailable: TV\nTV', 'Unavailable: Dryer\nDryer', 'Unavailable: Smoke alarm\nSmoke alarm', 'Unavailable: Carbon monoxide alarm\nCarbon monoxide alarm', 'Unavailable: Heating\nHeating']"
