listing_link,searched_location,title_bed_bats_review,price_per_night,review_count,review_count_link,host_link,host_response_rate,listing_description,cleanliness_ratings,accuracy_ratings,check-in_ratings,communication_ratings,location_ratings,value_ratings,google_map_location_link,facilities
https://www.airbnb.com/rooms/523062167419855952?adults=1&children=0&enable_m3_private_room=true&infants=0&pets=0&search_mode=regular_search&check_in=2024-06-13&check_out=2024-06-18&source_impression_id=p3_1718221024_P3BOWe4T57kBGo1v&previous_page_section_name=1000&federated_search_id=42b5bd94-e32e-407e-80f0-45454f6cf403,Chuadanga,Hotel in West Bengal · 1 bedroom · 1.5 shared baths,$19 ,2 reviews,https://www.airbnb.com/rooms/523062167419855952/reviews?adults=1&children=0&enable_m3_private_room=true&infants=0&pets=0&search_mode=regular_search&check_in=2024-06-13&check_out=2024-06-18&source_impression_id=p3_1718221024_P3BOWe4T57kBGo1v&previous_page_section_name=1000&federated_search_id=42b5bd94-e32e-407e-80f0-45454f6cf403,https://www.airbnb.com/users/show/430728044,Response rate: 100%,Enjoy easy access to popular shops and restaurants from this charming place to stay.,,,,,,,"https://maps.google.com/maps?ll=23.44481,88.46223&z=14&t=m&hl=en&gl=BD&mapclient=apiv3","['Bathtub', 'Cleaning products', 'OWN BRAND shampoo', 'OWN BRAND body soap', 'Hot water', 'Shower gel', 'Paid washer – In building', 'Essentials', 'Bed linens', 'Extra pillows and blankets', 'Iron', 'Clothing storage: closet', '32 inch HDTV with standard cable', 'Window guards', 'Air conditioning', 'Ceiling fan', 'Exterior security cameras on property', 'Smoke alarm', 'Fire extinguisher', 'First aid kit', 'Dedicated workspace', 'Private entrance', 'Shared backyard – Not fully fenced', 'Free parking on premises', 'Smoking allowed', 'Unavailable: Kitchen\nKitchen', 'Unavailable: Wifi\nWifi', 'Unavailable: Dryer\nDryer', 'Unavailable: Carbon monoxide alarm\nCarbon monoxide alarm', 'Unavailable: Heating\nHeating']"
https://www.airbnb.com/rooms/1165083167294181918?adults=1&children=0&enable_m3_private_room=true&infants=0&pets=0&search_mode=regular_search&check_in=2024-06-13&check_out=2024-06-18&source_impression_id=p3_1718221024_P3ROgBlGFbPiCaW-&previous_page_section_name=1000&federated_search_id=42b5bd94-e32e-407e-80f0-45454f6cf403,Chuadanga,Rental unit in Mayapur · ★New · 1 bedroom · 1 bath,$24 ,,,https://www.airbnb.com/users/show/575075789,Response rate: 100%,"Experience comfort in our modern 1-bedroom apartment, conveniently located just behind Mayapur Community Hospital and a 7-minute walk from ISKCON Mayapur. This apartment includes a cozy living room, kitchen with a water filter for drinking water, bathroom with hot water, and a private balcony. Enjoy basic amenities. A supermarket is nearby. Perfect for solo travelers, couples, or small families seeking convenience and relaxation. Book now for a pleasant stay!",,,,,,,"https://maps.google.com/maps?ll=23.4304,88.3877&z=14&t=m&hl=en&gl=BD&mapclient=apiv3","['Hangers', 'Clothing storage', 'Air conditioning', 'Kitchen', 'Unavailable: Exterior security cameras on property\nExterior security cameras on property', 'Unavailable: Wifi\nWifi', 'Unavailable: TV\nTV', 'Unavailable: Washer\nWasher', 'Unavailable: Dryer\nDryer', 'Unavailable: Essentials\nEssentials', 'Unavailable: Smoke alarm\nSmoke alarm', 'Unavailable: Carbon monoxide alarm\nCarbon monoxide alarm', 'Unavailable: Heating\nHeating', 'Unavailable: Hot water\nHot water']"
https://www.airbnb.com/rooms/653013880425523302?adults=1&category_tag=Tag%3A8678&children=0&enable_m3_private_room=true&infants=0&pets=0&photo_id=1567449488&search_mode=regular_search&check_in=2024-06-13&check_out=2024-06-18&source_impression_id=p3_1718221024_P3vbnhJ45aUaFW3_&previous_page_section_name=1000&federated_search_id=42b5bd94-e32e-407e-80f0-45454f6cf403,Chuadanga,Rental unit in Mayapur · ★4.83 · 1 bedroom · 1 bed · 1.5 shared baths,$30 ,6 reviews,https://www.airbnb.com/rooms/653013880425523302/reviews?adults=1&category_tag=Tag%3A8678&children=0&enable_m3_private_room=true&infants=0&pets=0&photo_id=1567449488&search_mode=regular_search&check_in=2024-06-13&check_out=2024-06-18&source_impression_id=p3_1718221024_P3vbnhJ45aUaFW3_&previous_page_section_name=1000&federated_search_id=42b5bd94-e32e-407e-80f0-45454f6cf403,https://www.airbnb.com/users/show/423553306,Response rate: 100%,,4.8,4.7,4.7,4.8,4.8,4.5,"https://maps.google.com/maps?ll=23.4298,88.3889&z=14&t=m&hl=en&gl=BD&mapclient=apiv3","['Garden view', 'River view', 'Bathtub', 'Cleaning products', 'Shampoo', 'Body soap', 'Hot water', 'Essentials', 'Bed linens', 'Extra pillows and blankets', 'Iron', 'Drying rack for clothing', 'Clothing storage: closet', 'Window guards', 'Air conditioning', 'Ceiling fan', 'Heating', 'Exterior security cameras on property', 'First aid kit', 'Wifi', 'Kitchen', 'Cooking basics', 'Dishes and silverware', 'Gas stove', 'Rice maker', 'Dining table', 'Private patio or balcony', 'Backyard', 'Outdoor dining area', 'Free parking on premises', 'Long term stays allowed', 'Cleaning available during stay', 'Unavailable: Lock on bedroom door\nLock on bedroom door', 'Unavailable: TV\nTV', 'Unavailable: Washer\nWasher', 'Unavailable: Dryer\nDryer', 'Unavailable: Smoke alarm\nSmoke alarm', 'Unavailable: Carbon monoxide alarm\nCarbon monoxide alarm']"
https://www.airbnb.com/rooms/1165026253427159092?adults=1&children=0&enable_m3_private_room=true&infants=0&pets=0&search_mode=regular_search&check_in=2024-06-13&check_out=2024-06-18&source_impression_id=p3_1718221024_P3aI6AVZ5E8eiRqB&previous_page_section_name=1000&federated_search_id=42b5bd94-e32e-407e-80f0-45454f6cf403,Chuadanga,Rental unit in Mayapur · ★New · 1 bedroom · 1 bath,$46 ,,,https://www.airbnb.com/users/show/575075789,Response rate: 100%,"Enjoy a cozy and modern 1-bedroom apartment just a 5-minute walk from ISKCON Mayapur. This stylish retreat features a living room, kitchen, bathroom with hot water, and a private balcony. Basic amenities and free parking are included. A restaurant is on the ground floor, and a supermarket is nearby. Perfect for solo travelers, couples, or small families seeking comfort and convenience. Book now for a memorable stay!",,,,,,,"https://maps.google.com/maps?ll=23.4307,88.3914&z=14&t=m&hl=en&gl=BD&mapclient=apiv3","['Window AC unit', 'Ceiling fan', 'Kitchen', 'Private entrance', 'Free carport on premises', 'Unavailable: Exterior security cameras on property\nExterior security cameras on property', 'Unavailable: Wifi\nWifi', 'Unavailable: TV\nTV', 'Unavailable: Washer\nWasher', 'Unavailable: Dryer\nDryer', 'Unavailable: Essentials\nEssentials', 'Unavailable: Smoke alarm\nSmoke alarm', 'Unavailable: Carbon monoxide alarm\nCarbon monoxide alarm', 'Unavailable: Heating\nHeating', 'Unavailable: Hot water\nHot water']"
https://www.airbnb.com/rooms/862857237710710698?adults=1&children=0&enable_m3_private_room=true&infants=0&pets=0&search_mode=regular_search&check_in=2024-06-13&check_out=2024-06-18&source_impression_id=p3_1718221026_P3MEU4C-4W232y3G&previous_page_section_name=1000&federated_search_id=0164173a-77c8-4695-9a51-f20f7b1cdfb6,Chuadanga,Guesthouse in Guptipara · 1 bedroom · 1 bed · 1 private bath,,,,https://www.airbnb.com/users/show/197489859,,"At Shree Hari Guest House you get every room with vitrified tiles , 24 hour inverter power back up , attached bath with geyser. Guptipara, the site of enormous Terracotta Mandir, famous Guptipara Rathyatra. It is the best couple friendly family hotel for staying near Jirat, Somra, Kalna, Santipur.",,,,,,,"https://maps.google.com/maps?ll=23.1932,88.4314&z=14&t=m&hl=en&gl=BD&mapclient=apiv3","['TV', 'Air conditioning', 'Exterior security cameras on property', 'Fire extinguisher', 'First aid kit', 'Wifi', 'Dedicated workspace', 'Free parking on premises', 'Smoking allowed', 'Unavailable: Kitchen\nKitchen', 'Unavailable: Washer\nWasher', 'Unavailable: Dryer\nDryer', 'Unavailable: Essentials\nEssentials', 'Unavailable: Smoke alarm\nSmoke alarm', 'Unavailable: Carbon monoxide alarm\nCarbon monoxide alarm', 'Unavailable: Heating\nHeating', 'Unavailable: Hot water\nHot water']"
