listing_link,searched_location,title_bed_bats_review,price_per_night,review_count,review_count_link,host_link,host_response_rate,listing_description,cleanliness_ratings,accuracy_ratings,check-in_ratings,communication_ratings,location_ratings,value_ratings,google_map_location_link,facilities
https://www.airbnb.com/rooms/573532306447220521?adults=1&children=0&enable_m3_private_room=true&infants=0&pets=0&search_mode=regular_search&check_in=2024-06-13&check_out=2024-06-18&source_impression_id=p3_1718221038_P3tWq2_ppJrek3Xk&previous_page_section_name=1000&federated_search_id=0393b7a0-e5bd-44b1-8e1b-230207672bbb,Cox's Bazar,Serviced apartment in Cox's Bazar · 2 bedrooms · 2 beds · 1 bath,$55 ,,,https://www.airbnb.com/users/show/253283896,Responds within a few days or more,,,,,,,,"https://maps.google.com/maps?ll=21.42563,91.97807&z=14&t=m&hl=en&gl=BD&mapclient=apiv3","['Beach view', 'Bay view', 'Sea view', 'City skyline view', 'Bathtub', 'Cleaning products', 'Shampoo', 'Body soap', 'Essentials', 'Hangers', 'Bed linens', 'Ethernet connection', 'TV', 'Air conditioning', 'Ceiling fan', 'Exterior security cameras on property', 'Fire extinguisher', 'First aid kit', 'Wifi', 'Mini fridge', 'Dining table', 'Beach access – Beachfront', 'Private entrance', 'Resort access', 'Outdoor furniture', 'Outdoor dining area', 'Free parking on premises', 'Elevator', 'Luggage dropoff allowed', 'Smoking allowed', 'Long term stays allowed', 'Self check-in', 'Lockbox', 'Unavailable: Kitchen\nKitchen', 'Unavailable: Washer\nWasher', 'Unavailable: Dryer\nDryer', 'Unavailable: Smoke alarm\nSmoke alarm', 'Unavailable: Carbon monoxide alarm\nCarbon monoxide alarm', 'Unavailable: Heating\nHeating', 'Unavailable: Hot water\nHot water']"
https://www.airbnb.com/rooms/604681784511539405?adults=1&children=0&enable_m3_private_room=true&infants=0&pets=0&search_mode=regular_search&check_in=2024-06-13&check_out=2024-06-18&source_impression_id=p3_1718221038_P3lZtIJrgLLZIw5a&previous_page_section_name=1000&federated_search_id=0393b7a0-e5bd-44b1-8e1b-230207672bbb,Cox's Bazar,Serviced apartment in Cox's Bazar · 2 bedrooms · 2 beds · 2 baths,$77 ,,,https://www.airbnb.com/users/show/448516426,Response rate: 40%,"Relax with the whole family at this peaceful place to stay in Cox's Bazar nearby sea beach. Beach is only 3 minutes walk from our apartment. Most unique habitate in Cox's Bazar with kitchen facility. We provide extra bed for $10.00.
You'll have a great time at this comfortable place to stay.",,,,,,,"https://maps.google.com/maps?ll=21.41565,91.98456&z=14&t=m&hl=en&gl=BD&mapclient=apiv3","['Bay view', 'Beach view', 'Ocean view', 'TV', 'Air conditioning', 'Exterior security cameras on property', 'Fire extinguisher', 'First aid kit', 'Wifi', 'Dedicated workspace', 'Kitchen', 'Gym', 'Paid parking on premises', 'Smoking allowed', 'Unavailable: Washer\nWasher', 'Unavailable: Dryer\nDryer', 'Unavailable: Essentials\nEssentials', 'Unavailable: Smoke alarm\nSmoke alarm', 'Unavailable: Carbon monoxide alarm\nCarbon monoxide alarm', 'Unavailable: Heating\nHeating', 'Unavailable: Hot water\nHot water']"
https://www.airbnb.com/rooms/607864301742970069?adults=1&children=0&enable_m3_private_room=true&infants=0&pets=0&search_mode=regular_search&check_in=2024-06-13&check_out=2024-06-18&source_impression_id=p3_1718221038_P3f6GgWa1BhUYCpF&previous_page_section_name=1000&federated_search_id=0393b7a0-e5bd-44b1-8e1b-230207672bbb,Cox's Bazar,Hotel in Cox's Bazar · 1 bedroom · 2 beds · 1 private bath,$40 ,,,https://www.airbnb.com/users/show/448516426,Response rate: 40%,Easily access local hot spots from this hip place in Cox's Bazar. Beach & Jhinuk market is only 400 meter away from our hotel. This room is ideal for guests who prefer a low commode in their washroom.,,,,,,,"https://maps.google.com/maps?ll=21.42556,91.97988&z=14&t=m&hl=en&gl=BD&mapclient=apiv3","['TV', 'Air conditioning', 'Exterior security cameras on property', 'Fire extinguisher', 'First aid kit', 'Wifi', 'Dedicated workspace', 'Free parking on premises', 'Unavailable: Kitchen\nKitchen', 'Unavailable: Washer\nWasher', 'Unavailable: Dryer\nDryer', 'Unavailable: Essentials\nEssentials', 'Unavailable: Smoke alarm\nSmoke alarm', 'Unavailable: Carbon monoxide alarm\nCarbon monoxide alarm', 'Unavailable: Heating\nHeating', 'Unavailable: Hot water\nHot water']"
https://www.airbnb.com/rooms/663997035925216629?adults=1&children=0&enable_m3_private_room=true&infants=0&pets=0&search_mode=regular_search&check_in=2024-06-13&check_out=2024-06-18&source_impression_id=p3_1718221040_P3H5zJdOmmgPW1Hv&previous_page_section_name=1000&federated_search_id=e88a94f9-e948-477e-80ee-859c65ee2799,Cox's Bazar,Hotel in Cox's Bazar · 1 bedroom · 1 bed · 1 private bath,$99 ,,,https://www.airbnb.com/users/show/448516426,Response rate: 40%,"Hotel The Cox Today is a privately owned 5 Star Standard Luxury Hotel in Cox's Bazar, Bangladesh. It is situated in an attractive location of Kolatoli Road, Cox's Bazar which is only 5 minutes drive form the Cox's Bazar Airport. It is a place of choice of most of the corporate executives, foreigners, newly married couples, and for those who prefer to stay in luxury with stunning view of The 'Bay of Bengal'.
Complimentary: buffet breakfast, swimming pool, gym and airport pick-up & drop service.",,,,,,,"https://maps.google.com/maps?ll=21.4262,91.9763&z=14&t=m&hl=en&gl=BD&mapclient=apiv3","['Beach view', 'City skyline view', 'Courtyard view', 'Garden view', 'Marina view', 'Mountain view', 'Ocean view', 'Resort view', 'Sea view', 'Outdoor shower', 'TV', 'Exercise equipment', 'Pool table', 'Air conditioning', 'Exterior security cameras on property', 'Smoke alarm', 'Fire extinguisher', 'First aid kit', 'Wifi', 'Dedicated workspace', 'BBQ grill', 'Free parking on premises', 'Pool', 'Smoking allowed', 'Self check-in', 'Building staff', 'Unavailable: Kitchen\nKitchen', 'Unavailable: Washer\nWasher', 'Unavailable: Dryer\nDryer', 'Unavailable: Essentials\nEssentials', 'Unavailable: Carbon monoxide alarm\nCarbon monoxide alarm', 'Unavailable: Heating\nHeating', 'Unavailable: Hot water\nHot water']"
https://www.airbnb.com/rooms/1020778115465306413?adults=1&children=0&enable_m3_private_room=true&infants=0&pets=0&search_mode=regular_search&check_in=2024-06-13&check_out=2024-06-18&source_impression_id=p3_1718221040_P3e-OgzeH6RzZR3-&previous_page_section_name=1000&federated_search_id=e88a94f9-e948-477e-80ee-859c65ee2799,Cox's Bazar,Rental unit in Cox's Bazar · ★3.33 · 2 bedrooms · 2 beds · 1 bath,$32 ,3 reviews,https://www.airbnb.com/rooms/1020778115465306413/reviews?adults=1&children=0&enable_m3_private_room=true&infants=0&pets=0&search_mode=regular_search&check_in=2024-06-13&check_out=2024-06-18&source_impression_id=p3_1718221040_P3e-OgzeH6RzZR3-&previous_page_section_name=1000&federated_search_id=e88a94f9-e948-477e-80ee-859c65ee2799,https://www.airbnb.com/users/show/545693531,Response rate: 100%,Your family will be close to everything when you stay at this centrally-located place.,2.7,3.7,3.7,4.0,4.3,3.3,"https://maps.google.com/maps?ll=21.4087,91.9888&z=14&t=m&hl=en&gl=BD&mapclient=apiv3","['Outdoor shower', 'TV', 'Air conditioning', 'Indoor fireplace', 'Exterior security cameras on property', 'Smoke alarm', 'Carbon monoxide alarm', 'Fire extinguisher', 'First aid kit', 'Wifi', 'Kitchen', 'Beach access – Beachfront', 'Laundromat nearby', 'BBQ grill', 'Free parking on premises', 'Hot tub', 'Unavailable: Washer\nWasher', 'Unavailable: Dryer\nDryer', 'Unavailable: Essentials\nEssentials', 'Unavailable: Heating\nHeating', 'Unavailable: Hot water\nHot water']"
