listing_link,searched_location,title_bed_bats_review,price_per_night,review_count,review_count_link,host_link,host_response_rate,listing_description,cleanliness_ratings,accuracy_ratings,check-in_ratings,communication_ratings,location_ratings,value_ratings,google_map_location_link,facilities
https://www.airbnb.com/rooms/647697114546083876?adults=1&children=0&enable_m3_private_room=true&infants=0&pets=0&search_mode=regular_search&check_in=2024-06-13&check_out=2024-06-18&source_impression_id=p3_1718221292_P3HQKthWHlkYogkp&previous_page_section_name=1000&federated_search_id=fd9c7239-80f1-4ad8-b8dc-c07d58bb2118,Patuakhali,Boutique hotel in Kuakata · 2 bedrooms · 3 beds · 2 baths,,,,https://www.airbnb.com/users/show/448516426,Response rate: 40%,"This stylish place is close to must-see destinations in Kuakata beach. Great for a group of 05 pax. In addition, luxurious furniture & supplies and stylish residential furnishing open greater opportunities to make your stay exciting and fascinating. It is ideal for family vacation, who don’t need suites, but would like to have comfort and elegance up to high quality.",,,,,,,"https://maps.google.com/maps?ll=21.8156,90.1385&z=14&t=m&hl=en&gl=BD&mapclient=apiv3","['Beach view', 'Canal view', 'City skyline view', 'Courtyard view', 'Garden view', 'Park view', 'Pool view', 'TV', 'Exercise equipment', 'Air conditioning', 'Exterior security cameras on property', 'Fire extinguisher', 'First aid kit', 'Wifi', 'Dedicated workspace', 'BBQ grill', 'Free parking on premises', 'Pool', 'Smoking allowed', 'Self check-in', 'Building staff', 'Unavailable: Kitchen\nKitchen', 'Unavailable: Washer\nWasher', 'Unavailable: Dryer\nDryer', 'Unavailable: Essentials\nEssentials', 'Unavailable: Smoke alarm\nSmoke alarm', 'Unavailable: Carbon monoxide alarm\nCarbon monoxide alarm', 'Unavailable: Heating\nHeating', 'Unavailable: Hot water\nHot water']"
https://www.airbnb.com/rooms/637950929924254583?adults=1&children=0&enable_m3_private_room=true&infants=0&pets=0&search_mode=regular_search&check_in=2024-06-13&check_out=2024-06-18&source_impression_id=p3_1718221292_P3ABS9BXDHefNhzq&previous_page_section_name=1000&federated_search_id=fd9c7239-80f1-4ad8-b8dc-c07d58bb2118,Patuakhali,Boutique hotel in লতাচাপলী · 1 bedroom · 1 bed · 1 private bath,,,,https://www.airbnb.com/users/show/448516426,Response rate: 40%,"Enjoy easy access to popular tourist attractions and restaurants from this charming place to stay in Kuakata. The needs of our guests, associates and owners are in the forefront of everything we do. Hotel Mohona has Restaurant facilitates. We provide delicious foods at reasonable prices.",,,,,,,"https://maps.google.com/maps?ll=21.8185,90.1211&z=14&t=m&hl=en&gl=BD&mapclient=apiv3","['Bay view', 'City skyline view', 'TV', 'Air conditioning', 'Exterior security cameras on property', 'Fire extinguisher', 'First aid kit', 'Wifi', 'Dedicated workspace', 'BBQ grill', 'Free parking on premises', 'Smoking allowed', 'Self check-in', 'Building staff', 'Unavailable: Kitchen\nKitchen', 'Unavailable: Washer\nWasher', 'Unavailable: Dryer\nDryer', 'Unavailable: Essentials\nEssentials', 'Unavailable: Smoke alarm\nSmoke alarm', 'Unavailable: Carbon monoxide alarm\nCarbon monoxide alarm', 'Unavailable: Heating\nHeating', 'Unavailable: Hot water\nHot water']"
https://www.airbnb.com/rooms/637948858490040587?adults=1&children=0&enable_m3_private_room=true&infants=0&pets=0&search_mode=regular_search&check_in=2024-06-13&check_out=2024-06-18&source_impression_id=p3_1718221292_P3efmGf0YubenMD2&previous_page_section_name=1000&federated_search_id=fd9c7239-80f1-4ad8-b8dc-c07d58bb2118,Patuakhali,Boutique hotel in লতাচাপলী · 1 bedroom · 1 bed · 1 private bath,,,,https://www.airbnb.com/users/show/448516426,Response rate: 40%,"Enjoy easy access to popular tourist attractions and restaurants from this charming place to stay in Kuakata. The needs of our guests, associates and owners are in the forefront of everything we do. Hotel Mohona has Restaurant facilitates. We provide delicious foods at reasonable prices.",,,,,,,"https://maps.google.com/maps?ll=21.8187,90.121&z=14&t=m&hl=en&gl=BD&mapclient=apiv3","['TV', 'Air conditioning', 'Exterior security cameras on property', 'Fire extinguisher', 'First aid kit', 'Wifi', 'Dedicated workspace', 'BBQ grill', 'Free parking on premises', 'Smoking allowed', 'Unavailable: Kitchen\nKitchen', 'Unavailable: Washer\nWasher', 'Unavailable: Dryer\nDryer', 'Unavailable: Essentials\nEssentials', 'Unavailable: Smoke alarm\nSmoke alarm', 'Unavailable: Carbon monoxide alarm\nCarbon monoxide alarm', 'Unavailable: Heating\nHeating', 'Unavailable: Hot water\nHot water']"
https://www.airbnb.com/rooms/636546653557064123?adults=1&children=0&enable_m3_private_room=true&infants=0&pets=0&search_mode=regular_search&check_in=2024-06-13&check_out=2024-06-18&source_impression_id=p3_1718221295_P3yNCEYhEve-rATA&previous_page_section_name=1000&federated_search_id=b45a926f-4270-4d5c-97b4-f99c07b0a3ab,Patuakhali,Boutique hotel in Kuakata · 1 bedroom · 1 bed · 1 private bath,,,,https://www.airbnb.com/users/show/448516426,Response rate: 40%,"This stylish place is close to must-see destinations in Kuakata.  Hotel Graver Inn has the maximum facilities you expect from a luxury whether you are with us on a business, pleasure, attending or organizing an event, you have access to arrange of superb comforts and amenities for an effortless and enjoyable stay for creating the perfect balance of modern comforts and nostalgic ambiance.",,,,,,,"https://maps.google.com/maps?ll=21.8157,90.1253&z=14&t=m&hl=en&gl=BD&mapclient=apiv3","['Beach view', 'City skyline view', 'Courtyard view', 'TV', 'Air conditioning', 'Exterior security cameras on property', 'Fire extinguisher', 'First aid kit', 'Wifi', 'Dedicated workspace', 'BBQ grill', 'Free parking on premises', 'Smoking allowed', 'Self check-in', 'Building staff', 'Unavailable: Kitchen\nKitchen', 'Unavailable: Washer\nWasher', 'Unavailable: Dryer\nDryer', 'Unavailable: Essentials\nEssentials', 'Unavailable: Smoke alarm\nSmoke alarm', 'Unavailable: Carbon monoxide alarm\nCarbon monoxide alarm', 'Unavailable: Heating\nHeating', 'Unavailable: Hot water\nHot water']"
https://www.airbnb.com/rooms/663032046372621623?adults=1&children=0&enable_m3_private_room=true&infants=0&pets=0&search_mode=regular_search&check_in=2024-06-13&check_out=2024-06-18&source_impression_id=p3_1718221295_P3D22OQBEmu-7kv_&previous_page_section_name=1000&federated_search_id=b45a926f-4270-4d5c-97b4-f99c07b0a3ab,Patuakhali,Boutique hotel in Barisal Division · 1 bedroom · 2 beds · 1 private bath,,,,https://www.airbnb.com/users/show/448516426,Response rate: 40%,"Enjoy the glamour of this stylish, upscale place in Kuakata. Easily access local hot spots from this hip place in Kuakata. Enjoy a luxurious experience when you stay at this special place in Kuakata. We are located in front of Rakhaine Women Market and the sea beach. Great for family and friends. In addition, luxurious furniture & supplies and stylish residential furnishing open greater opportunities to make your stay exciting and fascinating.",,,,,,,"https://maps.google.com/maps?ll=21.8166,90.1239&z=14&t=m&hl=en&gl=BD&mapclient=apiv3","['Beach view', 'City skyline view', 'Courtyard view', 'Garden view', 'Marina view', 'Ocean view', 'Park view', 'Resort view', 'Sea view', 'TV', 'Air conditioning', 'Exterior security cameras on property', 'Fire extinguisher', 'First aid kit', 'Wifi', 'Dedicated workspace', 'BBQ grill', 'Free parking on premises', 'Pool', 'Smoking allowed', 'Self check-in', 'Building staff', 'Unavailable: Kitchen\nKitchen', 'Unavailable: Washer\nWasher', 'Unavailable: Dryer\nDryer', 'Unavailable: Essentials\nEssentials', 'Unavailable: Smoke alarm\nSmoke alarm', 'Unavailable: Carbon monoxide alarm\nCarbon monoxide alarm', 'Unavailable: Heating\nHeating', 'Unavailable: Hot water\nHot water']"
