listing_link,searched_location,title_bed_bats_review,price_per_night,review_count,review_count_link,host_link,host_response_rate,listing_description,cleanliness_ratings,accuracy_ratings,check-in_ratings,communication_ratings,location_ratings,value_ratings,google_map_location_link,facilities
https://www.airbnb.com/rooms/1166148353359341573?adults=1&category_tag=Tag%3A8678&children=0&enable_m3_private_room=true&infants=0&pets=0&photo_id=1916909673&search_mode=regular_search&check_in=2024-06-13&check_out=2024-06-18&source_impression_id=p3_1718223307_P3FiXgSEgp_gwaWF&previous_page_section_name=1000&federated_search_id=9a6e332a-be8f-4a25-8afd-bf8ef8af0365,Farmgate,Bed and breakfast in Dhaka · ★New · 3 bedrooms · 3 baths,$198 ,,,https://www.airbnb.com/users/show/576349395,,"Situated in Dhaka, 1.6 km from Daffodil International University, Dhaka features accommodation with a fitness centre, free private parking, a terrace and a restaurant. This 3-star hotel offers an ATM and a concierge service. The accommodation offers a 24-hour front desk, airport transfers, room service and free WiFi throughout the property.

The rooms are fitted with air conditioning, a flat-screen TV with satellite channels, a minibar, a kettle, a bidet, free toiletries and a desk.",,,,,,,"https://maps.google.com/maps?ll=23.75754,90.38974&z=14&t=m&hl=en&gl=BD&mapclient=apiv3","['Hair dryer', 'Outdoor shower', 'Washer', 'Iron', 'TV', 'Exercise equipment', 'Pool table', 'Crib', 'Air conditioning', 'Indoor fireplace', 'Heating', 'Lock on bedroom door', 'Noise decibel monitors on property', 'Smoke alarm', 'Carbon monoxide alarm', 'Fire extinguisher', 'First aid kit', 'Wifi', 'Dedicated workspace', 'Kitchen', 'Cooking basics', 'Beach access – Beachfront', 'Lake access', 'Fire pit', 'Outdoor dining area', 'BBQ grill', 'Free parking on premises', 'Pool', 'Hot tub', 'Paid parking on premises', 'Pets allowed', 'Self check-in', 'Building staff', 'Unavailable: Exterior security cameras on property\nExterior security cameras on property', 'Unavailable: Dryer\nDryer', 'Unavailable: Essentials\nEssentials', 'Unavailable: Hot water\nHot water']"
https://www.airbnb.com/rooms/1085509883176129781?adults=1&children=0&enable_m3_private_room=true&infants=0&pets=0&search_mode=regular_search&check_in=2024-06-14&check_out=2024-06-19&source_impression_id=p3_1718223310_P3ciemtSfksE3Znd&previous_page_section_name=1000&federated_search_id=0027b8eb-1126-40e6-b818-3809b965e1a3,Farmgate,Rental unit in Dhaka · 2 bedrooms · 2 beds · 2 baths,$20 ,,,https://www.airbnb.com/users/show/560688318,Response rate: 75%,Relax with the whole family at this peaceful place to stay.,,,,,,,"https://maps.google.com/maps?ll=23.765707,90.395006&z=14&t=m&hl=en&gl=BD&mapclient=apiv3","['TV', 'Air conditioning', 'Exterior security cameras on property', 'Smoke alarm', 'Fire extinguisher', 'Wifi', 'Dedicated workspace', 'Kitchen', 'Free parking on premises', 'Unavailable: Washer\nWasher', 'Unavailable: Dryer\nDryer', 'Unavailable: Essentials\nEssentials', 'Unavailable: Carbon monoxide alarm\nCarbon monoxide alarm', 'Unavailable: Heating\nHeating', 'Unavailable: Hot water\nHot water']"
https://www.airbnb.com/rooms/42467708?adults=1&children=0&enable_m3_private_room=true&infants=0&pets=0&search_mode=regular_search&check_in=2024-06-13&check_out=2024-06-18&source_impression_id=p3_1718223338_P3DuIrFFQd08m9I3&previous_page_section_name=1000&federated_search_id=17a83a47-b31c-4a87-9dca-2f1f9b7317a2,Savar,Villa in Savar Union · ★5.0 · 2 bedrooms · 2 beds · 2 baths,$25 ,5 reviews,https://www.airbnb.com/rooms/42467708/reviews?adults=1&children=0&enable_m3_private_room=true&infants=0&pets=0&search_mode=regular_search&check_in=2024-06-13&check_out=2024-06-18&source_impression_id=p3_1718223338_P3DuIrFFQd08m9I3&previous_page_section_name=1000&federated_search_id=17a83a47-b31c-4a87-9dca-2f1f9b7317a2,https://www.airbnb.com/users/show/49087206,Response rate: 67%,,4.4,4.8,5.0,5.0,5.0,5.0,"https://maps.google.com/maps?ll=23.86763,90.28587&z=14&t=m&hl=en&gl=BD&mapclient=apiv3","['Bathtub', 'Cleaning products', 'Shampoo', 'Sunsilk body soap', 'Hot water', 'Shower gel', 'Essentials', 'Hangers', 'Room-darkening shades', 'Iron', 'Mosquito net', 'TV with standard cable', 'Window guards', 'Window AC unit', 'Ceiling fan', 'Portable fans', 'Exterior security cameras on property', 'First aid kit', 'Wifi', 'Dedicated workspace', 'Kitchen', 'Refrigerator', 'Microwave', 'Cooking basics', 'Dishes and silverware', 'Freezer', 'Stove', 'Samsung oven', 'Barbecue utensils', 'Dining table', 'Private entrance', 'Patio or balcony', 'Backyard', 'Free parking on premises', 'Free street parking', 'Pets allowed', 'Luggage dropoff allowed', 'Long term stays allowed', 'Self check-in', 'Lockbox', 'Unavailable: Washer\nWasher', 'Unavailable: Dryer\nDryer', 'Unavailable: Smoke alarm\nSmoke alarm', 'Unavailable: Carbon monoxide alarm\nCarbon monoxide alarm', 'Unavailable: Heating\nHeating']"
https://www.airbnb.com/rooms/1152927517484205375?adults=1&children=0&enable_m3_private_room=true&infants=0&pets=0&search_mode=regular_search&check_in=2024-06-14&check_out=2024-06-19&source_impression_id=p3_1718223340_P389V9yfBTH8Dr0f&previous_page_section_name=1000&federated_search_id=0de71c39-5a30-477e-b2d1-a5c70f0c2352,Savar,Rental unit in Dhamrai · ★New · 2 bedrooms · 2 beds · 3 baths,$20 ,,,https://www.airbnb.com/users/show/576687274,,Relax with your family and friends at this peaceful place to stay with a wonderful view. It has a beautiful terrace and the bedrooms has air conditioners.,,,,,,,"https://maps.google.com/maps?ll=23.911287,90.216597&z=14&t=m&hl=en&gl=BD&mapclient=apiv3","['Room-darkening shades', 'Mosquito net', 'Window guards', 'Air conditioning', 'Ceiling fan', 'Kitchen', 'Walton refrigerator', 'Microwave', 'Gas stove', 'Dining table', 'Free parking on premises', 'Pets allowed', 'Host greets you', 'Unavailable: Exterior security cameras on property\nExterior security cameras on property', 'Unavailable: Wifi\nWifi', 'Unavailable: TV\nTV', 'Unavailable: Washer\nWasher', 'Unavailable: Dryer\nDryer', 'Unavailable: Essentials\nEssentials', 'Unavailable: Smoke alarm\nSmoke alarm', 'Unavailable: Carbon monoxide alarm\nCarbon monoxide alarm', 'Unavailable: Heating\nHeating', 'Unavailable: Hot water\nHot water']"
https://www.airbnb.com/rooms/858263377337201617?adults=1&children=0&enable_m3_private_room=true&infants=0&pets=0&search_mode=regular_search&check_in=2024-06-13&check_out=2024-06-18&source_impression_id=p3_1718223348_P3OvFYhSkERXuvkw&previous_page_section_name=1000&federated_search_id=3596a2f0-18d8-4a92-97e0-f3773f98e252,Savar,Rental unit in Dhaka · ★4.86 · 3 bedrooms · 3 beds · 3 baths,,7 reviews,https://www.airbnb.com/rooms/858263377337201617/reviews?adults=1&children=0&enable_m3_private_room=true&infants=0&pets=0&search_mode=regular_search&check_in=2024-06-13&check_out=2024-06-18&source_impression_id=p3_1718223348_P3OvFYhSkERXuvkw&previous_page_section_name=1000&federated_search_id=3596a2f0-18d8-4a92-97e0-f3773f98e252,https://www.airbnb.com/users/show/507577251,Response rate: 100%,,4.9,4.9,5.0,4.9,4.7,4.7,"https://maps.google.com/maps?ll=23.85284,90.36149&z=14&t=m&hl=en&gl=BD&mapclient=apiv3","['Lake view', 'Courtyard view', 'City skyline view', 'Hair dryer', 'Cleaning products', 'Renowned shampoo', 'Conditioner', 'Lux body soap', 'Bidet', 'Hot water', 'Shower gel', 'Free washer – In unit', 'Dryer', 'Essentials', 'Hangers', 'Bed linens', 'Extra pillows and blankets', 'Room-darkening shades', 'Iron', 'Mosquito net', 'Clothing storage: wardrobe', 'Ethernet connection', '55 inch HDTV with Chromecast', 'Yamaha Bluetooth sound system', 'Books and reading material', 'Movie theater', 'Children’s books and toys', 'Window guards', ""Children's playroom"", 'Outdoor playground', 'AC - split type ductless system', 'Ceiling fan', 'Portable fans', 'Fire extinguisher', 'First aid kit', 'Wifi', 'Dedicated workspace', 'Kitchen', 'Renowned refrigerator', 'Microwave', 'Cooking basics', 'Dishes and silverware', 'Oven', 'Hot water kettle', 'Coffee maker', 'Wine glasses', 'Blender', 'Dining table', 'Coffee', 'Shared backyard – Not fully fenced', 'Free parking on premises', 'Elevator', 'Pets allowed', 'Smoking allowed', 'Self check-in', 'Lockbox', 'Host greets you', 'Unavailable: Exterior security cameras on property\nExterior security cameras on property', 'Unavailable: Smoke alarm\nSmoke alarm', 'Unavailable: Carbon monoxide alarm\nCarbon monoxide alarm', 'Unavailable: Heating\nHeating']"
