listing_link,searched_location,title_bed_bats_review,price_per_night,review_count,review_count_link,host_link,host_response_rate,listing_description,cleanliness_ratings,accuracy_ratings,check-in_ratings,communication_ratings,location_ratings,value_ratings,google_map_location_link,facilities
https://www.airbnb.com/rooms/604455233602350397?adults=1&children=0&enable_m3_private_room=true&infants=0&pets=0&search_mode=regular_search&check_in=2024-06-13&check_out=2024-06-18&source_impression_id=p3_1718221038_P3Gkx8VdekGuE_4I&previous_page_section_name=1000&federated_search_id=0393b7a0-e5bd-44b1-8e1b-230207672bbb,Cox's Bazar,Serviced apartment in Cox's Bazar · 2 bedrooms · 2 beds · 1 bath,$42 ,,,https://www.airbnb.com/users/show/448516426,Response rate: 40%,Bring the whole family to this great place with lots of room for fun in Cox's Bazar. Ideal for 4 person family. You will have the full kitchen with utencils in this apartment. Famous Sugondha Beach is only 400 meters away of our place.Bring the whole family to this great place with lots of room for fun.,,,,,,,"https://maps.google.com/maps?ll=21.42524,91.98016&z=14&t=m&hl=en&gl=BD&mapclient=apiv3","['Washer', 'TV', 'Air conditioning', 'Exterior security cameras on property', 'Fire extinguisher', 'Dedicated workspace', 'Kitchen', 'BBQ grill', 'Free parking on premises', 'Unavailable: Wifi\nWifi', 'Unavailable: Dryer\nDryer', 'Unavailable: Essentials\nEssentials', 'Unavailable: Smoke alarm\nSmoke alarm', 'Unavailable: Carbon monoxide alarm\nCarbon monoxide alarm', 'Unavailable: Heating\nHeating', 'Unavailable: Hot water\nHot water']"
https://www.airbnb.com/rooms/621551131074788747?adults=1&children=0&enable_m3_private_room=true&infants=0&pets=0&search_mode=regular_search&check_in=2024-06-13&check_out=2024-06-18&source_impression_id=p3_1718221038_P3_I6kFZzWs0wcOh&previous_page_section_name=1000&federated_search_id=0393b7a0-e5bd-44b1-8e1b-230207672bbb,Cox's Bazar,Serviced apartment in Cox's Bazar · 2 bedrooms · 1 bed · 1.5 baths,$50 ,,,https://www.airbnb.com/users/show/397496480,Response rate: 100%,"Make some memories at this unique and family-friendly place in Cox's Bazar. Beach is only 3 minutes walk from our apartment. Most unique habitate in Cox's Bazar .
You'll have a great time at this comfortable place to stay.",,,,,,,"https://maps.google.com/maps?ll=21.4235,91.9814&z=14&t=m&hl=en&gl=BD&mapclient=apiv3","['TV', 'Air conditioning', 'Exterior security cameras on property', 'Smoke alarm', 'Fire extinguisher', 'First aid kit', 'Wifi', 'Dedicated workspace', 'Refrigerator', 'Free parking on premises', 'Private hot tub', 'Smoking allowed', 'Unavailable: Kitchen\nKitchen', 'Unavailable: Washer\nWasher', 'Unavailable: Dryer\nDryer', 'Unavailable: Essentials\nEssentials', 'Unavailable: Carbon monoxide alarm\nCarbon monoxide alarm', 'Unavailable: Heating\nHeating', 'Unavailable: Hot water\nHot water']"
https://www.airbnb.com/rooms/604451209411080796?adults=1&children=0&enable_m3_private_room=true&infants=0&pets=0&search_mode=regular_search&check_in=2024-06-13&check_out=2024-06-18&source_impression_id=p3_1718221038_P3Xj_3zAEc7sqe7-&previous_page_section_name=1000&federated_search_id=0393b7a0-e5bd-44b1-8e1b-230207672bbb,Cox's Bazar,Serviced apartment in Cox's Bazar · 2 bedrooms · 2 beds · 1 bath,$33 ,,,https://www.airbnb.com/users/show/448516426,Response rate: 40%,Bring the whole family to this great place with lots of room for fun in Cox's Bazar. You will have the full kitchen with utencils in this apartment. Famous Sugondha Beach is only 400 meters away of our place.,,,,,,,"https://maps.google.com/maps?ll=21.42677,91.97823&z=14&t=m&hl=en&gl=BD&mapclient=apiv3","['Washer', 'TV', 'Air conditioning', 'Exterior security cameras on property', 'Fire extinguisher', 'Dedicated workspace', 'Kitchen', 'BBQ grill', 'Free parking on premises', 'Unavailable: Wifi\nWifi', 'Unavailable: Dryer\nDryer', 'Unavailable: Essentials\nEssentials', 'Unavailable: Smoke alarm\nSmoke alarm', 'Unavailable: Carbon monoxide alarm\nCarbon monoxide alarm', 'Unavailable: Heating\nHeating', 'Unavailable: Hot water\nHot water']"
https://www.airbnb.com/rooms/915898834718755517?adults=1&children=0&enable_m3_private_room=true&infants=0&pets=0&search_mode=regular_search&check_in=2024-06-14&check_out=2024-06-19&source_impression_id=p3_1718221038_P3UkCfwbLnBPfEua&previous_page_section_name=1000&federated_search_id=0393b7a0-e5bd-44b1-8e1b-230207672bbb,Cox's Bazar,Rental unit in Cox's Bazar · 2 bedrooms · 2 beds · 2 baths,$96 ,,,https://www.airbnb.com/users/show/520506216,,"Experience a tropical paradise at Cox's Bazar World Beach Resort Dear [Guest Name], We hope this email finds you well. We are thrilled to introduce your gateway to Cox's Bazar World Beach Resort, Located on the pristine shores of Cox's Bazar, the world's longest natural sandy beach, our resort offers an exquisite blend of luxury, natural beauty and warm hospitality. As the region's leading beach resort, we pride ourselves on providing our guests with an extraordinary experience.",,,,,,,"https://maps.google.com/maps?ll=21.4164,91.9865&z=14&t=m&hl=en&gl=BD&mapclient=apiv3","['Hair dryer', 'Washer', 'Iron', 'TV', 'Air conditioning', 'Exterior security cameras on property', 'Smoke alarm', 'Fire extinguisher', 'Wifi', 'Dedicated workspace', 'Kitchen', 'Beach access – Beachfront', 'Outdoor dining area', 'Free parking on premises', 'Pool', 'Pets allowed', 'Smoking allowed', 'Self check-in', 'Lockbox', 'Unavailable: Dryer\nDryer', 'Unavailable: Essentials\nEssentials', 'Unavailable: Carbon monoxide alarm\nCarbon monoxide alarm', 'Unavailable: Heating\nHeating', 'Unavailable: Hot water\nHot water']"
https://www.airbnb.com/rooms/1053682972383499258?adults=1&children=0&enable_m3_private_room=true&infants=0&pets=0&search_mode=regular_search&check_in=2024-06-13&check_out=2024-06-18&source_impression_id=p3_1718221038_P37_GOOPWu-fZ_Vj&previous_page_section_name=1000&federated_search_id=0393b7a0-e5bd-44b1-8e1b-230207672bbb,Cox's Bazar,Hotel in Cox's Bazar · 1 bedroom · 1 bed · 1 private bath,,,,https://www.airbnb.com/users/show/221516729,Response rate: 100%,,,,,,,,"https://maps.google.com/maps?ll=21.408419,91.989671&z=14&t=m&hl=en&gl=BD&mapclient=apiv3","['Beach view', 'Mountain view', 'Pool view', 'Ocean view', 'Garden view', 'Sea view', 'Bathtub', 'Hair dryer', 'Cleaning products', 'Shampoo', 'Conditioner', 'Body soap', 'Hot water', 'Shower gel', 'Essentials', 'Hangers', 'Bed linens', 'Room-darkening shades', 'Safe', 'Mosquito net', 'Clothing storage', 'Ethernet connection', 'TV', 'Exercise equipment', 'Books and reading material', 'Air conditioning', 'Fire extinguisher', 'Wifi', 'Dedicated workspace', 'Refrigerator', 'Mini fridge', 'Hot water kettle', 'Coffee maker: pour-over coffee', 'Coffee', 'Beach access – Beachfront', 'Patio or balcony', 'Free parking on premises', 'Shared pool', 'Private hot tub', 'Shared sauna', 'Elevator', 'Gym', 'Paid parking on premises', 'Luggage dropoff allowed', 'Breakfast', 'Smoking allowed', 'Self check-in', 'Building staff', 'Cleaning available during stay', 'Unavailable: Exterior security cameras on property\nExterior security cameras on property', 'Unavailable: Kitchen\nKitchen', 'Unavailable: Washer\nWasher', 'Unavailable: Dryer\nDryer', 'Unavailable: Smoke alarm\nSmoke alarm', 'Unavailable: Carbon monoxide alarm\nCarbon monoxide alarm', 'Unavailable: Heating\nHeating']"
