,review_link,reviewer_name,reviewer_profile_link,info,rating_comment,rating_extra
0,https://www.airbnb.com/rooms/964302296707829098/reviews?adults=1&children=0&enable_m3_private_room=true&infants=0&pets=0&search_mode=regular_search&check_in=2024-06-13&check_out=2024-06-18&source_impression_id=p3_1718221341_P39_9MzUPoNv1qVZ&previous_page_section_name=1000&federated_search_id=7e234165-c400-47d7-9a81-9f4f409f50cd,Abir,https://www.airbnb.com/users/show/550047336,"Rating, 5 stars,  · 1 week ago,  · Stayed one night","Good Host
- Great Place
- Good Location
- Clean Place
- Well Decorated
- Peace",India
1,https://www.airbnb.com/rooms/964302296707829098/reviews?adults=1&children=0&enable_m3_private_room=true&infants=0&pets=0&search_mode=regular_search&check_in=2024-06-13&check_out=2024-06-18&source_impression_id=p3_1718221341_P39_9MzUPoNv1qVZ&previous_page_section_name=1000&federated_search_id=7e234165-c400-47d7-9a81-9f4f409f50cd,Md Abdullah Al,https://www.airbnb.com/users/show/470740083,"Rating, 5 stars,  · 2 weeks ago,  · Stayed with kids",We are pleasure to stay here and will come again,2 years on Airbnb
2,https://www.airbnb.com/rooms/964302296707829098/reviews?adults=1&children=0&enable_m3_private_room=true&infants=0&pets=0&search_mode=regular_search&check_in=2024-06-13&check_out=2024-06-18&source_impression_id=p3_1718221341_P39_9MzUPoNv1qVZ&previous_page_section_name=1000&federated_search_id=7e234165-c400-47d7-9a81-9f4f409f50cd,Prakhar,https://www.airbnb.com/users/show/561420666,"Rating, 5 stars,  · 2 weeks ago,  · Stayed one night","very good place, near airport. well.kept",4 months on Airbnb
3,https://www.airbnb.com/rooms/964302296707829098/reviews?adults=1&children=0&enable_m3_private_room=true&infants=0&pets=0&search_mode=regular_search&check_in=2024-06-13&check_out=2024-06-18&source_impression_id=p3_1718221341_P39_9MzUPoNv1qVZ&previous_page_section_name=1000&federated_search_id=7e234165-c400-47d7-9a81-9f4f409f50cd,Azad,https://www.airbnb.com/users/show/32446647,"Rating, 5 stars,  · 3 weeks ago",We enjoyed our stay at Aysha’s place. The place is nice and clean and we felt like home. We will surely book the place again.,9 years on Airbnb
4,https://www.airbnb.com/rooms/964302296707829098/reviews?adults=1&children=0&enable_m3_private_room=true&infants=0&pets=0&search_mode=regular_search&check_in=2024-06-13&check_out=2024-06-18&source_impression_id=p3_1718221341_P39_9MzUPoNv1qVZ&previous_page_section_name=1000&federated_search_id=7e234165-c400-47d7-9a81-9f4f409f50cd,Prakhar,https://www.airbnb.com/users/show/561420666,"Rating, 5 stars,  · May 2024,  · Stayed one night",great stay as always,4 months on Airbnb
5,https://www.airbnb.com/rooms/964302296707829098/reviews?adults=1&children=0&enable_m3_private_room=true&infants=0&pets=0&search_mode=regular_search&check_in=2024-06-13&check_out=2024-06-18&source_impression_id=p3_1718221341_P39_9MzUPoNv1qVZ&previous_page_section_name=1000&federated_search_id=7e234165-c400-47d7-9a81-9f4f409f50cd,Ahmet Kemal,https://www.airbnb.com/users/show/554134878,"Rating, 5 stars,  · May 2024,  · Stayed a few nights",It was a pleasant stay and the house was very clean and nice,5 months on Airbnb
6,https://www.airbnb.com/rooms/964302296707829098/reviews?adults=1&children=0&enable_m3_private_room=true&infants=0&pets=0&search_mode=regular_search&check_in=2024-06-13&check_out=2024-06-18&source_impression_id=p3_1718221341_P39_9MzUPoNv1qVZ&previous_page_section_name=1000&federated_search_id=7e234165-c400-47d7-9a81-9f4f409f50cd,Prakhar,https://www.airbnb.com/users/show/561420666,"Rating, 5 stars,  · May 2024,  · Stayed one night","place is great, close to the airport. some more utensils. glasses, cups can be kept. but overall, good experience. bathrooms were clean, very important.",4 months on Airbnb
7,https://www.airbnb.com/rooms/964302296707829098/reviews?adults=1&children=0&enable_m3_private_room=true&infants=0&pets=0&search_mode=regular_search&check_in=2024-06-13&check_out=2024-06-18&source_impression_id=p3_1718221341_P39_9MzUPoNv1qVZ&previous_page_section_name=1000&federated_search_id=7e234165-c400-47d7-9a81-9f4f409f50cd,Zohurul,https://www.airbnb.com/users/show/558340123,"Rating, 5 stars,  · April 2024,  · Stayed one night","The check-in process was seamless, the place was lovely, and the host was responsive.","Naogaon, Bangladesh"
8,https://www.airbnb.com/rooms/964302296707829098/reviews?adults=1&children=0&enable_m3_private_room=true&infants=0&pets=0&search_mode=regular_search&check_in=2024-06-13&check_out=2024-06-18&source_impression_id=p3_1718221341_P39_9MzUPoNv1qVZ&previous_page_section_name=1000&federated_search_id=7e234165-c400-47d7-9a81-9f4f409f50cd,Samiul,https://www.airbnb.com/users/show/572586267,"Rating, 5 stars,  · April 2024,  · Stayed a few nights",Aysha is a fantastic host and the apartment was beautiful and pristine. A hidden treasure and felt truly at home. Having come from abroad the place had all the creature comforts and cleanliness one would expect if staying in an apartment in a western country. Will definitely use again for any future visits,2 months on Airbnb
9,https://www.airbnb.com/rooms/964302296707829098/reviews?adults=1&children=0&enable_m3_private_room=true&infants=0&pets=0&search_mode=regular_search&check_in=2024-06-13&check_out=2024-06-18&source_impression_id=p3_1718221341_P39_9MzUPoNv1qVZ&previous_page_section_name=1000&federated_search_id=7e234165-c400-47d7-9a81-9f4f409f50cd,Md Abdul,https://www.airbnb.com/users/show/554762058,"Rating, 5 stars,  · April 2024,  · Stayed one night","good host, nice place, everything was perfect.",5 months on Airbnb
10,https://www.airbnb.com/rooms/964302296707829098/reviews?adults=1&children=0&enable_m3_private_room=true&infants=0&pets=0&search_mode=regular_search&check_in=2024-06-13&check_out=2024-06-18&source_impression_id=p3_1718221341_P39_9MzUPoNv1qVZ&previous_page_section_name=1000&federated_search_id=7e234165-c400-47d7-9a81-9f4f409f50cd,Marvin,https://www.airbnb.com/users/show/506451640,"Rating, 5 stars,  · April 2024",We enjoyed our stay once again very nice place.thank you.,1 year on Airbnb
11,https://www.airbnb.com/rooms/964302296707829098/reviews?adults=1&children=0&enable_m3_private_room=true&infants=0&pets=0&search_mode=regular_search&check_in=2024-06-13&check_out=2024-06-18&source_impression_id=p3_1718221341_P39_9MzUPoNv1qVZ&previous_page_section_name=1000&federated_search_id=7e234165-c400-47d7-9a81-9f4f409f50cd,Patty,https://www.airbnb.com/users/show/301658890,"Rating, 5 stars,  · April 2024,  · Stayed a few nights",Nice house,5 years on Airbnb
12,https://www.airbnb.com/rooms/964302296707829098/reviews?adults=1&children=0&enable_m3_private_room=true&infants=0&pets=0&search_mode=regular_search&check_in=2024-06-13&check_out=2024-06-18&source_impression_id=p3_1718221341_P39_9MzUPoNv1qVZ&previous_page_section_name=1000&federated_search_id=7e234165-c400-47d7-9a81-9f4f409f50cd,Marvin,https://www.airbnb.com/users/show/506451640,"Rating, 5 stars,  · March 2024",Just like the reviews before me each one was what is expected spacious neat tidy and will definitely recommend again.,1 year on Airbnb
13,https://www.airbnb.com/rooms/964302296707829098/reviews?adults=1&children=0&enable_m3_private_room=true&infants=0&pets=0&search_mode=regular_search&check_in=2024-06-13&check_out=2024-06-18&source_impression_id=p3_1718221341_P39_9MzUPoNv1qVZ&previous_page_section_name=1000&federated_search_id=7e234165-c400-47d7-9a81-9f4f409f50cd,Jagadeesh,https://www.airbnb.com/users/show/175734012,"Rating, 5 stars,  · February 2024,  · Stayed about a week","Pleasant and supportive host , very nice house , spacious rooms and neat kitchen . Very near many amenities too and it’s a convenient place of stay .",6 years on Airbnb
14,https://www.airbnb.com/rooms/964302296707829098/reviews?adults=1&children=0&enable_m3_private_room=true&infants=0&pets=0&search_mode=regular_search&check_in=2024-06-13&check_out=2024-06-18&source_impression_id=p3_1718221341_P39_9MzUPoNv1qVZ&previous_page_section_name=1000&federated_search_id=7e234165-c400-47d7-9a81-9f4f409f50cd,Soukufa,https://www.airbnb.com/users/show/439579021,"Rating, 5 stars,  · February 2024,  · Stayed about a week",Had all the necessities there. We were new to bangladesh and a first aid kit was helpful when we were in trouble. Toddler and elder friendly too. A high chair and a nebulizer was available. All the things needed were there plus some. Our stay was short but worth while.,"Boston, Massachusetts"
15,https://www.airbnb.com/rooms/964302296707829098/reviews?adults=1&children=0&enable_m3_private_room=true&infants=0&pets=0&search_mode=regular_search&check_in=2024-06-13&check_out=2024-06-18&source_impression_id=p3_1718221341_P39_9MzUPoNv1qVZ&previous_page_section_name=1000&federated_search_id=7e234165-c400-47d7-9a81-9f4f409f50cd,Dinesh,https://www.airbnb.com/users/show/437858790,"Rating, 5 stars,  · January 2024,  · Stayed a few nights",Loved the place. The location was good and quiet.,"Kathmandu, Nepal"
16,https://www.airbnb.com/rooms/964302296707829098/reviews?adults=1&children=0&enable_m3_private_room=true&infants=0&pets=0&search_mode=regular_search&check_in=2024-06-13&check_out=2024-06-18&source_impression_id=p3_1718221341_P39_9MzUPoNv1qVZ&previous_page_section_name=1000&federated_search_id=7e234165-c400-47d7-9a81-9f4f409f50cd,Sanjoy,https://www.airbnb.com/users/show/507291562,"Rating, 5 stars,  · January 2024","It was wonderful to stay in Aysha place, will recommend this place.",1 year on Airbnb
17,https://www.airbnb.com/rooms/964302296707829098/reviews?adults=1&children=0&enable_m3_private_room=true&infants=0&pets=0&search_mode=regular_search&check_in=2024-06-13&check_out=2024-06-18&source_impression_id=p3_1718221341_P39_9MzUPoNv1qVZ&previous_page_section_name=1000&federated_search_id=7e234165-c400-47d7-9a81-9f4f409f50cd,Badhon,https://www.airbnb.com/users/show/546722969,"Rating, 4 stars,  · January 2024,  · Stayed with kids","It was a very pleasant stay! Everything was neat and organized. Also, the place was very secured and safe. Greatly recommend this place.",7 months on Airbnb
18,https://www.airbnb.com/rooms/964302296707829098/reviews?adults=1&children=0&enable_m3_private_room=true&infants=0&pets=0&search_mode=regular_search&check_in=2024-06-13&check_out=2024-06-18&source_impression_id=p3_1718221341_P39_9MzUPoNv1qVZ&previous_page_section_name=1000&federated_search_id=7e234165-c400-47d7-9a81-9f4f409f50cd,Md Shariful,https://www.airbnb.com/users/show/194609791,"Rating, 5 stars,  · January 2024,  · Stayed a few nights","it was a wonderful stay with my family. very good location, everything nearby. beautiful apartment, well decorated. Right at the centre of Uttara still quite peaceful. Host is extremely communicative and helpful.
you will have everything you need for your stay. the rooms are quite big. for your daily needs like restaurants, shopping mall, grocery stores all are just minutes walk far. Definitely we will come back. highly recommended",6 years on Airbnb
19,https://www.airbnb.com/rooms/964302296707829098/reviews?adults=1&children=0&enable_m3_private_room=true&infants=0&pets=0&search_mode=regular_search&check_in=2024-06-13&check_out=2024-06-18&source_impression_id=p3_1718221341_P39_9MzUPoNv1qVZ&previous_page_section_name=1000&federated_search_id=7e234165-c400-47d7-9a81-9f4f409f50cd,Naeem,https://www.airbnb.com/users/show/253121873,"Rating, 5 stars,  · December 2023,  · Stayed about a week",Enjoyed my stay at Aysha’s apartment. The place was as described and served my purpose brilliantly. Highly recommend Aysha as a host.,"New York, United States"
20,https://www.airbnb.com/rooms/964302296707829098/reviews?adults=1&children=0&enable_m3_private_room=true&infants=0&pets=0&search_mode=regular_search&check_in=2024-06-13&check_out=2024-06-18&source_impression_id=p3_1718221341_P39_9MzUPoNv1qVZ&previous_page_section_name=1000&federated_search_id=7e234165-c400-47d7-9a81-9f4f409f50cd,Javed,https://www.airbnb.com/users/show/40294387,"Rating, 5 stars,  · December 2023,  · Stayed one night","Lots of space inside the apartment.
You can stay here for a very long time
they have a washing machine, microwave, iron.
There was a lot of noise outside, but this is bangladesh.",9 years on Airbnb
21,https://www.airbnb.com/rooms/964302296707829098/reviews?adults=1&children=0&enable_m3_private_room=true&infants=0&pets=0&search_mode=regular_search&check_in=2024-06-13&check_out=2024-06-18&source_impression_id=p3_1718221341_P39_9MzUPoNv1qVZ&previous_page_section_name=1000&federated_search_id=7e234165-c400-47d7-9a81-9f4f409f50cd,Deen,https://www.airbnb.com/users/show/156451031,"Rating, 5 stars,  · November 2023,  · Stayed a few nights",I had a great stay in this apartment. Nice and clean with reasonable price.,7 years on Airbnb
22,https://www.airbnb.com/rooms/964302296707829098/reviews?adults=1&children=0&enable_m3_private_room=true&infants=0&pets=0&search_mode=regular_search&check_in=2024-06-13&check_out=2024-06-18&source_impression_id=p3_1718221341_P39_9MzUPoNv1qVZ&previous_page_section_name=1000&federated_search_id=7e234165-c400-47d7-9a81-9f4f409f50cd,Md Abdullah Al,https://www.airbnb.com/users/show/470740083,"Rating, 5 stars,  · October 2023,  · Stayed with kids","Clean, quite, communicative and respectful. Such a wonderful hosting experience for us. My children enjoying this environment.",2 years on Airbnb
23,https://www.airbnb.com/rooms/964302296707829098/reviews?adults=1&children=0&enable_m3_private_room=true&infants=0&pets=0&search_mode=regular_search&check_in=2024-06-13&check_out=2024-06-18&source_impression_id=p3_1718221341_P39_9MzUPoNv1qVZ&previous_page_section_name=1000&federated_search_id=7e234165-c400-47d7-9a81-9f4f409f50cd,Mohammad Tareq,https://www.airbnb.com/users/show/477169208,"Rating, 5 stars,  · September 2023,  · Stayed a few nights","Very tidy and lovely AirBnb apartment in Dhaka, Uttara near Airport and equipped with everything you need. A good bed and nice bathroom.  Aysha is a great host and there when you need her, Very nice and wants to share all hé know about the area. We had a great stay!",2 years on Airbnb
24,https://www.airbnb.com/rooms/964302296707829098/reviews?adults=1&children=0&enable_m3_private_room=true&infants=0&pets=0&search_mode=regular_search&check_in=2024-06-13&check_out=2024-06-18&source_impression_id=p3_1718221341_P39_9MzUPoNv1qVZ&previous_page_section_name=1000&federated_search_id=7e234165-c400-47d7-9a81-9f4f409f50cd,,,,,
25,https://www.airbnb.com/rooms/964302296707829098/reviews?adults=1&children=0&enable_m3_private_room=true&infants=0&pets=0&search_mode=regular_search&check_in=2024-06-13&check_out=2024-06-18&source_impression_id=p3_1718221341_P39_9MzUPoNv1qVZ&previous_page_section_name=1000&federated_search_id=7e234165-c400-47d7-9a81-9f4f409f50cd,,,,,
