,review_link,reviewer_name,reviewer_profile_link,info,rating_comment,rating_extra
0,https://www.airbnb.com/rooms/611695168129271012/reviews?adults=1&category_tag=Tag%3A8678&children=0&enable_m3_private_room=true&infants=0&pets=0&photo_id=1386046033&search_mode=regular_search&check_in=2024-06-13&check_out=2024-06-18&source_impression_id=p3_1718223738_P3bh91slzkgVLI-Q&previous_page_section_name=1000&federated_search_id=eb505835-63f6-45a7-8680-d20cdf55bb46,Md Harun,https://www.airbnb.com/users/show/319629096,"Rating, 5 stars,  · February 2023,  · Stayed a few nights",Outstanding hospitality & spent a great time in his apartment.,4 years on Airbnb
1,https://www.airbnb.com/rooms/611695168129271012/reviews?adults=1&category_tag=Tag%3A8678&children=0&enable_m3_private_room=true&infants=0&pets=0&photo_id=1386046033&search_mode=regular_search&check_in=2024-06-13&check_out=2024-06-18&source_impression_id=p3_1718223738_P3bh91slzkgVLI-Q&previous_page_section_name=1000&federated_search_id=eb505835-63f6-45a7-8680-d20cdf55bb46,Laura,https://www.airbnb.com/users/show/374574718,"Rating, 4 stars,  · July 2022,  · Stayed a few nights",He was very polite and asked how we were doing during our stay. The caretaker helped us check in. Md. Ashif allowed us to do a late checkout. We were able to do some cooking in their kitchen too. There's a fan in the bedroom to keep you cool. Overall felt safe and satisfied here,"Sylhet, Bangladesh"
2,https://www.airbnb.com/rooms/611695168129271012/reviews?adults=1&category_tag=Tag%3A8678&children=0&enable_m3_private_room=true&infants=0&pets=0&photo_id=1386046033&search_mode=regular_search&check_in=2024-06-13&check_out=2024-06-18&source_impression_id=p3_1718223738_P3bh91slzkgVLI-Q&previous_page_section_name=1000&federated_search_id=eb505835-63f6-45a7-8680-d20cdf55bb46,Nur,https://www.airbnb.com/users/show/257471168,"Rating, 5 stars,  · June 2022",It's a good short stay. Very Quiet and good night sleep. it's worthy.,5 years on Airbnb
3,https://www.airbnb.com/rooms/611695168129271012/reviews?adults=1&category_tag=Tag%3A8678&children=0&enable_m3_private_room=true&infants=0&pets=0&photo_id=1386046033&search_mode=regular_search&check_in=2024-06-13&check_out=2024-06-18&source_impression_id=p3_1718223738_P3bh91slzkgVLI-Q&previous_page_section_name=1000&federated_search_id=eb505835-63f6-45a7-8680-d20cdf55bb46,Md Nurain,https://www.airbnb.com/users/show/456981232,"Rating, 5 stars,  · May 2022,  · Stayed a few nights",It’s okay,2 years on Airbnb
4,https://www.airbnb.com/rooms/611695168129271012/reviews?adults=1&category_tag=Tag%3A8678&children=0&enable_m3_private_room=true&infants=0&pets=0&photo_id=1386046033&search_mode=regular_search&check_in=2024-06-13&check_out=2024-06-18&source_impression_id=p3_1718223738_P3bh91slzkgVLI-Q&previous_page_section_name=1000&federated_search_id=eb505835-63f6-45a7-8680-d20cdf55bb46,Yasmin,https://www.airbnb.com/users/show/146799760,"Rating, 5 stars,  · May 2022,  · Stayed a few nights","We felt at home in the airbnb! Ashif was an excellent host, whom we never met in person, but was always contactable and super friendly. He arranged everything for us superbly and instructing the nice caretaker. The apartment has the essentials, so you can take care of yourself very well. The apartment is very well located, shopping is within walking distance. We will be happy to come back, thanks for everything!",7 years on Airbnb
