,review_link,reviewer_name,reviewer_profile_link,info,rating_comment,rating_extra
0,https://www.airbnb.com/rooms/37458616/reviews?adults=1&category_tag=Tag%3A8678&children=0&enable_m3_private_room=true&infants=0&pets=0&photo_id=1255516946&search_mode=regular_search&check_in=2024-08-02&check_out=2024-08-07&source_impression_id=p3_1718223745_P3KVTUdUt0XXJAz4&previous_page_section_name=1000&federated_search_id=3325458b-78bc-48d3-a095-eb2ff52247ba,Anil,https://www.airbnb.com/users/show/494069106,"Rating, 3 stars,  · 2 weeks ago","Rooms was good and host was very prompt in reply
The problem were
1) there was no lift and it is on 3rd floor
2) there was no drawing room and sitting area to watch tv or spend time
Rest all was ok",1 year on Airbnb
1,https://www.airbnb.com/rooms/37458616/reviews?adults=1&category_tag=Tag%3A8678&children=0&enable_m3_private_room=true&infants=0&pets=0&photo_id=1255516946&search_mode=regular_search&check_in=2024-08-02&check_out=2024-08-07&source_impression_id=p3_1718223745_P3KVTUdUt0XXJAz4&previous_page_section_name=1000&federated_search_id=3325458b-78bc-48d3-a095-eb2ff52247ba,Zamiul,https://www.airbnb.com/users/show/271196385,"Rating, 5 stars,  · 3 weeks ago,  · Stayed a few nights",Clean and safe place to stay. A bit noisy but that is Dhaka for you. Rikta was a wonderful host.,"DeKalb, Illinois"
2,https://www.airbnb.com/rooms/37458616/reviews?adults=1&category_tag=Tag%3A8678&children=0&enable_m3_private_room=true&infants=0&pets=0&photo_id=1255516946&search_mode=regular_search&check_in=2024-08-02&check_out=2024-08-07&source_impression_id=p3_1718223745_P3KVTUdUt0XXJAz4&previous_page_section_name=1000&federated_search_id=3325458b-78bc-48d3-a095-eb2ff52247ba,Kazi,https://www.airbnb.com/users/show/572509958,"Rating, 5 stars,  · May 2024,  · Stayed a few nights",Rikta was responsive. She was always offering her assistance to ensure my comfortable stay. The surrounding environment was nice with lake view. I would love to stay again.,"Dhaka, Bangladesh"
3,https://www.airbnb.com/rooms/37458616/reviews?adults=1&category_tag=Tag%3A8678&children=0&enable_m3_private_room=true&infants=0&pets=0&photo_id=1255516946&search_mode=regular_search&check_in=2024-08-02&check_out=2024-08-07&source_impression_id=p3_1718223745_P3KVTUdUt0XXJAz4&previous_page_section_name=1000&federated_search_id=3325458b-78bc-48d3-a095-eb2ff52247ba,Iurii,https://www.airbnb.com/users/show/2062366,"Rating, 5 stars,  · April 2024,  · Stayed a few nights","All fine! The room is clean, has private bathroom, kitchen is equipped. Located in nice area.","Kyiv, Ukraine"
4,https://www.airbnb.com/rooms/37458616/reviews?adults=1&category_tag=Tag%3A8678&children=0&enable_m3_private_room=true&infants=0&pets=0&photo_id=1255516946&search_mode=regular_search&check_in=2024-08-02&check_out=2024-08-07&source_impression_id=p3_1718223745_P3KVTUdUt0XXJAz4&previous_page_section_name=1000&federated_search_id=3325458b-78bc-48d3-a095-eb2ff52247ba,Minhaz,https://www.airbnb.com/users/show/169494798,"Rating, 5 stars,  · April 2024,  · Stayed over a week","Staying at the RF's apartment was really nice. The place was big, clean, and easy to get to Gulshan and other parts of Dhaka. It's right by Niketon gate #2 or near the Dhaka Swissotel, so it's easy to find when you're using your own car, Uber, or a taxi. The host was helpful and always answered my questions quickly. And if I needed anything, her husband was there to help too.
One thing to note is that Dhaka can be noisy, especially with traffic noise until midnight. But the room had a great balcony that caught a nice breeze, which I loved, especially in the summer. Overall, my experience at the RF's apartment was excellent.",Brunei
5,https://www.airbnb.com/rooms/37458616/reviews?adults=1&category_tag=Tag%3A8678&children=0&enable_m3_private_room=true&infants=0&pets=0&photo_id=1255516946&search_mode=regular_search&check_in=2024-08-02&check_out=2024-08-07&source_impression_id=p3_1718223745_P3KVTUdUt0XXJAz4&previous_page_section_name=1000&federated_search_id=3325458b-78bc-48d3-a095-eb2ff52247ba,Bushra,https://www.airbnb.com/users/show/55802394,"Rating, 5 stars,  · April 2024,  · Stayed over a week",This place had great view form balcony and the room was every spacious . The cleaning support was excellent and the kitchen had all equipments. The security of the area and building was very good. The host was very responsive and helpful. The stay was just like home,"Austin, Texas"
6,https://www.airbnb.com/rooms/37458616/reviews?adults=1&category_tag=Tag%3A8678&children=0&enable_m3_private_room=true&infants=0&pets=0&photo_id=1255516946&search_mode=regular_search&check_in=2024-08-02&check_out=2024-08-07&source_impression_id=p3_1718223745_P3KVTUdUt0XXJAz4&previous_page_section_name=1000&federated_search_id=3325458b-78bc-48d3-a095-eb2ff52247ba,Farhan,https://www.airbnb.com/users/show/554059791,"Rating, 5 stars,  · March 2024,  · Stayed about a week",I arrived really late for a delayed flight and Rikta still welcomed me whole heartedly. The place was always kept clean.,5 months on Airbnb
7,https://www.airbnb.com/rooms/37458616/reviews?adults=1&category_tag=Tag%3A8678&children=0&enable_m3_private_room=true&infants=0&pets=0&photo_id=1255516946&search_mode=regular_search&check_in=2024-08-02&check_out=2024-08-07&source_impression_id=p3_1718223745_P3KVTUdUt0XXJAz4&previous_page_section_name=1000&federated_search_id=3325458b-78bc-48d3-a095-eb2ff52247ba,Mehnaj,https://www.airbnb.com/users/show/558460070,"Rating, 5 stars,  · March 2024,  · Stayed over a week","Great location and beautiful surrounding
atmosphere.Most friendly and helpful host.Room itself was well equipped and comfortable.","Jashore, Bangladesh"
8,https://www.airbnb.com/rooms/37458616/reviews?adults=1&category_tag=Tag%3A8678&children=0&enable_m3_private_room=true&infants=0&pets=0&photo_id=1255516946&search_mode=regular_search&check_in=2024-08-02&check_out=2024-08-07&source_impression_id=p3_1718223745_P3KVTUdUt0XXJAz4&previous_page_section_name=1000&federated_search_id=3325458b-78bc-48d3-a095-eb2ff52247ba,Joy,https://www.airbnb.com/users/show/442832903,"Rating, 5 stars,  · December 2023,  · Stayed a few nights","I had an outstanding stay at this Airbnb apartment. It offered a serene and peaceful atmosphere, equipped with all the essentials for a comfortable experience. The owner's friendliness and helpfulness made my visit even more enjoyable. The surrounding area was exceptionally beautiful, complemented by a stunning view from the windows. I encountered no issues during my stay, and the facilities provided were top-notch. I highly recommend this place for a five-star experience.",Netherlands
9,https://www.airbnb.com/rooms/37458616/reviews?adults=1&category_tag=Tag%3A8678&children=0&enable_m3_private_room=true&infants=0&pets=0&photo_id=1255516946&search_mode=regular_search&check_in=2024-08-02&check_out=2024-08-07&source_impression_id=p3_1718223745_P3KVTUdUt0XXJAz4&previous_page_section_name=1000&federated_search_id=3325458b-78bc-48d3-a095-eb2ff52247ba,Janet,https://www.airbnb.com/users/show/5955029,"Rating, 5 stars,  · November 2023,  · Stayed a few nights","Rikta Florence was an exceptional host. She was so friendly & responsive, always checking that we had everything we needed. She was really helpful in doing our laundry. The caretaker was great in helping with the bags & getting an Uber.
The place was a home from home, a normal home where you can have an authentic local stay. It was very clean, spacious & comfortable with full netting to prevent mosquitoes.
There is some traffic noise but this is Dhaka & it is a very busy noisy city. We didn’t find it disturbing.
Highly recommend staying here.",11 years on Airbnb
10,https://www.airbnb.com/rooms/37458616/reviews?adults=1&category_tag=Tag%3A8678&children=0&enable_m3_private_room=true&infants=0&pets=0&photo_id=1255516946&search_mode=regular_search&check_in=2024-08-02&check_out=2024-08-07&source_impression_id=p3_1718223745_P3KVTUdUt0XXJAz4&previous_page_section_name=1000&federated_search_id=3325458b-78bc-48d3-a095-eb2ff52247ba,Zarifuddin,https://www.airbnb.com/users/show/227410464,"Rating, 5 stars,  · October 2023,  · Stayed about a week",She is a very kind and respectful person would love to stay here every time i come to Dhaka,"Aurora, Colorado"
11,https://www.airbnb.com/rooms/37458616/reviews?adults=1&category_tag=Tag%3A8678&children=0&enable_m3_private_room=true&infants=0&pets=0&photo_id=1255516946&search_mode=regular_search&check_in=2024-08-02&check_out=2024-08-07&source_impression_id=p3_1718223745_P3KVTUdUt0XXJAz4&previous_page_section_name=1000&federated_search_id=3325458b-78bc-48d3-a095-eb2ff52247ba,Anggi,https://www.airbnb.com/users/show/269362040,"Rating, 5 stars,  · July 2023,  · Stayed about a week","Rikta has a very strategic placement of her apartment as you can reach many places around without much time and hassle. The property is very strategic even only 350m from Aarong! View from the apartment is also lovely. Besides, daily necessities is handy when needed to be used and bought. Although plaster condition inside the listing can be a bit improved. Overall, it was a nice and lovely stay with housemaid helping you to get your room and usages cleaned if you don't mind climbing a bit stairs ✨",5 years on Airbnb
12,https://www.airbnb.com/rooms/37458616/reviews?adults=1&category_tag=Tag%3A8678&children=0&enable_m3_private_room=true&infants=0&pets=0&photo_id=1255516946&search_mode=regular_search&check_in=2024-08-02&check_out=2024-08-07&source_impression_id=p3_1718223745_P3KVTUdUt0XXJAz4&previous_page_section_name=1000&federated_search_id=3325458b-78bc-48d3-a095-eb2ff52247ba,Mahmud,https://www.airbnb.com/users/show/419084937,"Rating, 5 stars,  · May 2023,  · Stayed a few nights",Rikta was very nice and really welcomed us. We loved being her guest. Definitely recommend.,3 years on Airbnb
13,https://www.airbnb.com/rooms/37458616/reviews?adults=1&category_tag=Tag%3A8678&children=0&enable_m3_private_room=true&infants=0&pets=0&photo_id=1255516946&search_mode=regular_search&check_in=2024-08-02&check_out=2024-08-07&source_impression_id=p3_1718223745_P3KVTUdUt0XXJAz4&previous_page_section_name=1000&federated_search_id=3325458b-78bc-48d3-a095-eb2ff52247ba,Inteemum,https://www.airbnb.com/users/show/438692279,"Rating, 5 stars,  · May 2023,  · Stayed about a week",Fantastic host. Really friendly and flexible. Everything was super smooth.,"Haverford, Pennsylvania"
14,https://www.airbnb.com/rooms/37458616/reviews?adults=1&category_tag=Tag%3A8678&children=0&enable_m3_private_room=true&infants=0&pets=0&photo_id=1255516946&search_mode=regular_search&check_in=2024-08-02&check_out=2024-08-07&source_impression_id=p3_1718223745_P3KVTUdUt0XXJAz4&previous_page_section_name=1000&federated_search_id=3325458b-78bc-48d3-a095-eb2ff52247ba,Biswanath,https://www.airbnb.com/users/show/120376882,"Rating, 5 stars,  · February 2023,  · Stayed over a week","In one word - excellent. I stayed in this listing for a month and it has a homely environment. The host is very helpful and accommodating. The room is large with all necessary furniture pieces and adequate seating arrangement. Natural light from two sides and adequate electric lights, including a bed side lamp. The veranda with a mini garden is superb. And the entire veranda is netted for protection against mosquitos. It is a luxury to sit there and enjoy the gentle breeze from the lake next door. Internet connectivity is stable and good. Everything the listing has on offer was useful to me - the work desk, overhead fan, more than enough universal wall sockets on all walls, nice and clean bathroom with hot water, room cleaning everyday, changing towel, bedsheet and pilow covers every week, electric tea maker in the room, filtered drinking water, a kitchenette for guest use that has a refrigerator, microwave oven, an induction cooker, rice cooker, utensils, and cutleries.",7 years on Airbnb
15,https://www.airbnb.com/rooms/37458616/reviews?adults=1&category_tag=Tag%3A8678&children=0&enable_m3_private_room=true&infants=0&pets=0&photo_id=1255516946&search_mode=regular_search&check_in=2024-08-02&check_out=2024-08-07&source_impression_id=p3_1718223745_P3KVTUdUt0XXJAz4&previous_page_section_name=1000&federated_search_id=3325458b-78bc-48d3-a095-eb2ff52247ba,Kay,https://www.airbnb.com/users/show/29304445,"Rating, 4 stars,  · January 2023,  · Stayed a few nights","+ Very friendly hostess who answers round the clock and promptly to questions, the visa application was therefore much easier + Central location on the 3rd floor of a residential building in Niketan - There were several problems with the hot water supply, which Rikta could partially fix during my stay. Conclusion: Recommended",9 years on Airbnb
16,https://www.airbnb.com/rooms/37458616/reviews?adults=1&category_tag=Tag%3A8678&children=0&enable_m3_private_room=true&infants=0&pets=0&photo_id=1255516946&search_mode=regular_search&check_in=2024-08-02&check_out=2024-08-07&source_impression_id=p3_1718223745_P3KVTUdUt0XXJAz4&previous_page_section_name=1000&federated_search_id=3325458b-78bc-48d3-a095-eb2ff52247ba,Priyanka,https://www.airbnb.com/users/show/45900874,"Rating, 5 stars,  · January 2023,  · Stayed a few nights","I had the most peaceful and amazing stay in Dhaka at Rikta's flat. I have been travelling to Dhaka for a decade now and this was my first time staying in an Airbnb. Rikta is a wonderful host who is prompt in her responses and makes sure that her guests are comfortable. The location of the flat is great, just a stone's throw from the Hatirjheel lake with easy access to various modes of transport. The area is also easily navigable on foot. The room was spotlessly clean and matched the photographs and description exactly. It is a huge room which can sleep 2-3 people, so it was really convenient for me as a single woman travelling in Dhaka. The flat is extremely secure with a helpful caretaker who is readily available to assist you with your luggage. Whether you're travelling for work or for a holiday in Dhaka, this flat is well-equipped to suit both needs. I would strongly recommend this place to anyone visiting Dhaka and am looking forward to staying here again. Thank you so much, Rikta!",9 years on Airbnb
17,https://www.airbnb.com/rooms/37458616/reviews?adults=1&category_tag=Tag%3A8678&children=0&enable_m3_private_room=true&infants=0&pets=0&photo_id=1255516946&search_mode=regular_search&check_in=2024-08-02&check_out=2024-08-07&source_impression_id=p3_1718223745_P3KVTUdUt0XXJAz4&previous_page_section_name=1000&federated_search_id=3325458b-78bc-48d3-a095-eb2ff52247ba,B M,https://www.airbnb.com/users/show/20308969,"Rating, 3 stars,  · November 2022,  · Stayed about a week",Rikta is a nice and caring host. The place is exactly as it was described in her ad. The location was good but nearbe a main raod which cause quiet a lot noise at nights. apart from that the stay was nice.,10 years on Airbnb
18,https://www.airbnb.com/rooms/37458616/reviews?adults=1&category_tag=Tag%3A8678&children=0&enable_m3_private_room=true&infants=0&pets=0&photo_id=1255516946&search_mode=regular_search&check_in=2024-08-02&check_out=2024-08-07&source_impression_id=p3_1718223745_P3KVTUdUt0XXJAz4&previous_page_section_name=1000&federated_search_id=3325458b-78bc-48d3-a095-eb2ff52247ba,Arifur,https://www.airbnb.com/users/show/144267053,"Rating, 4 stars,  · September 2022,  · Stayed a few nights","Rikta is a super host, the room & amenities are very good for a comfortable stay.",7 years on Airbnb
19,https://www.airbnb.com/rooms/37458616/reviews?adults=1&category_tag=Tag%3A8678&children=0&enable_m3_private_room=true&infants=0&pets=0&photo_id=1255516946&search_mode=regular_search&check_in=2024-08-02&check_out=2024-08-07&source_impression_id=p3_1718223745_P3KVTUdUt0XXJAz4&previous_page_section_name=1000&federated_search_id=3325458b-78bc-48d3-a095-eb2ff52247ba,Anupam,https://www.airbnb.com/users/show/32402739,"Rating, 5 stars,  · August 2022",Thanks Rikta once again,9 years on Airbnb
20,https://www.airbnb.com/rooms/37458616/reviews?adults=1&category_tag=Tag%3A8678&children=0&enable_m3_private_room=true&infants=0&pets=0&photo_id=1255516946&search_mode=regular_search&check_in=2024-08-02&check_out=2024-08-07&source_impression_id=p3_1718223745_P3KVTUdUt0XXJAz4&previous_page_section_name=1000&federated_search_id=3325458b-78bc-48d3-a095-eb2ff52247ba,Dr-Bara',,"Rating, 5 stars,  · August 2022,  · Stayed a few nights",It was a very comfortable place with a kindful host.,"Amman, Jordan"
21,https://www.airbnb.com/rooms/37458616/reviews?adults=1&category_tag=Tag%3A8678&children=0&enable_m3_private_room=true&infants=0&pets=0&photo_id=1255516946&search_mode=regular_search&check_in=2024-08-02&check_out=2024-08-07&source_impression_id=p3_1718223745_P3KVTUdUt0XXJAz4&previous_page_section_name=1000&federated_search_id=3325458b-78bc-48d3-a095-eb2ff52247ba,Abrar,https://www.airbnb.com/users/show/244002719,"Rating, 5 stars,  · August 2022,  · Stayed over a week","Great value for money and great location, Flat was clean and welcoming, beds were comfy and the shower was great very nice neighborhood","New York, United States"
22,https://www.airbnb.com/rooms/37458616/reviews?adults=1&category_tag=Tag%3A8678&children=0&enable_m3_private_room=true&infants=0&pets=0&photo_id=1255516946&search_mode=regular_search&check_in=2024-08-02&check_out=2024-08-07&source_impression_id=p3_1718223745_P3KVTUdUt0XXJAz4&previous_page_section_name=1000&federated_search_id=3325458b-78bc-48d3-a095-eb2ff52247ba,Anupam,https://www.airbnb.com/users/show/32402739,"Rating, 5 stars,  · July 2022","Rikta is an amazing host. Very helpful and ensures that all her hosts are comfortable. The house is really nice and clean with all amenities and a balcony. But the best thing about her room is that it’s spacious . Located in a posh neighbourhood of Dhaka, all places are easily accessible.",9 years on Airbnb
23,https://www.airbnb.com/rooms/37458616/reviews?adults=1&category_tag=Tag%3A8678&children=0&enable_m3_private_room=true&infants=0&pets=0&photo_id=1255516946&search_mode=regular_search&check_in=2024-08-02&check_out=2024-08-07&source_impression_id=p3_1718223745_P3KVTUdUt0XXJAz4&previous_page_section_name=1000&federated_search_id=3325458b-78bc-48d3-a095-eb2ff52247ba,Ishraque,https://www.airbnb.com/users/show/468456875,"Rating, 5 stars,  · July 2022,  · Stayed a few nights","The place is nice and cozy as shown in the listing, it is accurate . The location is also very convenient.
To give everyone a headsup her apartment is on the 4th floor and the building doesn’t have an elevator. Other than that it’s a nice place to stay and great service provided with all the amenities.",2 years on Airbnb
24,https://www.airbnb.com/rooms/37458616/reviews?adults=1&category_tag=Tag%3A8678&children=0&enable_m3_private_room=true&infants=0&pets=0&photo_id=1255516946&search_mode=regular_search&check_in=2024-08-02&check_out=2024-08-07&source_impression_id=p3_1718223745_P3KVTUdUt0XXJAz4&previous_page_section_name=1000&federated_search_id=3325458b-78bc-48d3-a095-eb2ff52247ba,,,,,
25,https://www.airbnb.com/rooms/37458616/reviews?adults=1&category_tag=Tag%3A8678&children=0&enable_m3_private_room=true&infants=0&pets=0&photo_id=1255516946&search_mode=regular_search&check_in=2024-08-02&check_out=2024-08-07&source_impression_id=p3_1718223745_P3KVTUdUt0XXJAz4&previous_page_section_name=1000&federated_search_id=3325458b-78bc-48d3-a095-eb2ff52247ba,,,,,
