,review_link,reviewer_name,reviewer_profile_link,info,rating_comment,rating_extra
0,https://www.airbnb.com/rooms/53662202/reviews?adults=1&children=0&enable_m3_private_room=true&infants=0&pets=0&search_mode=regular_search&check_in=2024-07-07&check_out=2024-07-14&source_impression_id=p3_1718223578_P3qsHTbhdf5TYsAh&previous_page_section_name=1000&federated_search_id=124caf6a-a1d9-4294-9937-7b66113a7f5a,Syed,https://www.airbnb.com/users/show/433044947,"Rating, 5 stars,  · February 2024,  · Stayed over a week","Mr Rana was extremely polite ,gentle and courteous was always there when l needed something and even extended his hand to drive me around to familiarize with the neighbourhood but thankfully said no , l recommend Mr.Rana to have as a host .lts safe gated
and easily accessible.
Mr. Rana and his site attendants are also polite and honest.",3 years on Airbnb
1,https://www.airbnb.com/rooms/53662202/reviews?adults=1&children=0&enable_m3_private_room=true&infants=0&pets=0&search_mode=regular_search&check_in=2024-07-07&check_out=2024-07-14&source_impression_id=p3_1718223578_P3qsHTbhdf5TYsAh&previous_page_section_name=1000&federated_search_id=124caf6a-a1d9-4294-9937-7b66113a7f5a,Jun,https://www.airbnb.com/users/show/540905426,"Rating, 5 stars,  · January 2024,  · Stayed over a week","I come to Bangladesh for business and looking for long term economic stay some where near the metro. Staying at AR Studio Home was an absolute pleasure. The location was perfect, with easy access to Metro station here. The apartment itself was comfortable, and the kitchen was well-equipped. Communication with the host was seamless, and they were always available to help and answer any questions. I would highly recommend this apartment to anyone looking for a great place to stay in Dhaka.""💖✨",8 months on Airbnb
2,https://www.airbnb.com/rooms/53662202/reviews?adults=1&children=0&enable_m3_private_room=true&infants=0&pets=0&search_mode=regular_search&check_in=2024-07-07&check_out=2024-07-14&source_impression_id=p3_1718223578_P3qsHTbhdf5TYsAh&previous_page_section_name=1000&federated_search_id=124caf6a-a1d9-4294-9937-7b66113a7f5a,Nasir,https://www.airbnb.com/users/show/524374525,"Rating, 5 stars,  · August 2023,  · Stayed about a week","A hidden gem in Mirpur, Dhaka!! A cosy place to relax for a very reasonable price!! This place is in a true residential area, very quiet and away from all the traffic noise which really helped me to do all my work in peace!! Eating places and supermarkets are near by and there are stores who would even deliver whatever you need right at your doorstep without any extra charge!! I mean what a convenience!!
Mr. Rana is a true gentleman and a super host in every sense!! He was always there for me whenever i needed anything and went above and beyond to make me feel comfortable!! It was a pleasure to stay there and i would definitely stay there again!!",11 months on Airbnb
3,https://www.airbnb.com/rooms/53662202/reviews?adults=1&children=0&enable_m3_private_room=true&infants=0&pets=0&search_mode=regular_search&check_in=2024-07-07&check_out=2024-07-14&source_impression_id=p3_1718223578_P3qsHTbhdf5TYsAh&previous_page_section_name=1000&federated_search_id=124caf6a-a1d9-4294-9937-7b66113a7f5a,Hasib,https://www.airbnb.com/users/show/432813420,"Rating, 5 stars,  · May 2023,  · Stayed over a week",My best airbnb ever. Rana is a very good host.,"Dallas, Texas"
4,https://www.airbnb.com/rooms/53662202/reviews?adults=1&children=0&enable_m3_private_room=true&infants=0&pets=0&search_mode=regular_search&check_in=2024-07-07&check_out=2024-07-14&source_impression_id=p3_1718223578_P3qsHTbhdf5TYsAh&previous_page_section_name=1000&federated_search_id=124caf6a-a1d9-4294-9937-7b66113a7f5a,Erik,https://www.airbnb.com/users/show/5572762,"Rating, 5 stars,  · March 2023,  · Stayed over a week","Rana owns a house with several floors - he rents different units, ask him and select the what could fit. On the ground floor he has a workshop where he creativly creates & fixes his homestays so that they have ""that certain something"" . I think I have seldom or never had a host who takes his job as a host so seriously and fulfills this task with so much passion and heart and soul like Rana. His apartments may not be the cleanest or the quietest compared to what you see in other countries, but you can see that everything is designed with love, that the colors have been carefully selected and what is most notable is that he is always available and friendly, whatever problem may arise. Rana helped me in many ways to get along in the jungle of Dhaka. He drove me even to the supermarket twice and he was very interested in a personal, warm exchange with me. If you are looking for an accommodation in Dhaka for all kind of budgets and tastes, I recommend this experience.",11 years on Airbnb
5,https://www.airbnb.com/rooms/53662202/reviews?adults=1&children=0&enable_m3_private_room=true&infants=0&pets=0&search_mode=regular_search&check_in=2024-07-07&check_out=2024-07-14&source_impression_id=p3_1718223578_P3qsHTbhdf5TYsAh&previous_page_section_name=1000&federated_search_id=124caf6a-a1d9-4294-9937-7b66113a7f5a,Sayem,https://www.airbnb.com/users/show/490543841,"Rating, 4 stars,  · February 2023,  · Stayed about a week","Good place to stay, recommend this place.",2 years on Airbnb
6,https://www.airbnb.com/rooms/53662202/reviews?adults=1&children=0&enable_m3_private_room=true&infants=0&pets=0&search_mode=regular_search&check_in=2024-07-07&check_out=2024-07-14&source_impression_id=p3_1718223578_P3qsHTbhdf5TYsAh&previous_page_section_name=1000&federated_search_id=124caf6a-a1d9-4294-9937-7b66113a7f5a,Mohammad Ashraful,https://www.airbnb.com/users/show/435875175,"Rating, 4 stars,  · February 2023,  · Stayed about a week",Has good communication skill ...helpful,3 years on Airbnb
7,https://www.airbnb.com/rooms/53662202/reviews?adults=1&children=0&enable_m3_private_room=true&infants=0&pets=0&search_mode=regular_search&check_in=2024-07-07&check_out=2024-07-14&source_impression_id=p3_1718223578_P3qsHTbhdf5TYsAh&previous_page_section_name=1000&federated_search_id=124caf6a-a1d9-4294-9937-7b66113a7f5a,Anwar,https://www.airbnb.com/users/show/164389225,"Rating, 5 stars,  · February 2022,  · Stayed over a week",Very nice personality and good communication skills! Will rent again,"Denton, Texas"
