,review_link,reviewer_name,reviewer_profile_link,info,rating_comment,rating_extra
0,https://www.airbnb.com/rooms/47791413/reviews?adults=1&children=0&enable_m3_private_room=true&infants=0&pets=0&search_mode=regular_search&check_in=2024-06-13&check_out=2024-06-18&source_impression_id=p3_1718221279_P3k4DXPOIhSvciYR&previous_page_section_name=1000&federated_search_id=2a5bd084-8464-40de-91a5-6d35feb0b576,Damayanti,https://www.airbnb.com/users/show/487295646,"Rating, 4 stars,  · December 2022","This facility is nice and clean. Host is cordial & helpful up to some extent. The room I stayed was quite open, airy & full of sunlight. It is not riverside though. :-)
They don't have restaurant attached,. Also there is no nearby restaurant to have food. However hotel reception can order & get food from faraway restaurant .
They have some basic things missing:
1. There's NO option to have coffee in morning. They call some place & can only get a cup of tea. They can't even able to provide hot water in flask & a cup! I usually carry my own coffee & just request for a flask full of hot water. But alas! here they can't give.
2. They don't have lift. They don't have any helping hand to carry the luggage onto 1st floor. So I, an Arthritis patient had to carry my 15 kg suitcase across 18 steps. People with any kind of discomfiture should think twice before booking.
Nice place to stay for young & able bodied people.",2 years on Airbnb
