,review_link,reviewer_name,reviewer_profile_link,info,rating_comment,rating_extra
0,https://www.airbnb.com/rooms/51971503/reviews?adults=1&category_tag=Tag%3A8678&children=0&enable_m3_private_room=true&infants=0&pets=0&photo_id=1246300514&search_mode=regular_search&check_in=2024-06-13&check_out=2024-06-18&source_impression_id=p3_1718221059_P3ZuAZzzp3_MIKka&previous_page_section_name=1000&federated_search_id=30f82058-a7f3-463c-9568-31e4c24d8d52,Mohammed Ziaur,https://www.airbnb.com/users/show/578233633,"Rating, 5 stars,  路 1 week ago,  路 Stayed one night","The hotel's location is ideal, close to the main tourist attractions, but far enough away to guarantee tranquility and rest. I would highly recommend this hotel to anyone looking for a relaxing and luxurious vacation. We will return without hesitation!
---
This type of review highlights the positive aspects of the hotel, such as the",New to Airbnb
1,https://www.airbnb.com/rooms/51971503/reviews?adults=1&category_tag=Tag%3A8678&children=0&enable_m3_private_room=true&infants=0&pets=0&photo_id=1246300514&search_mode=regular_search&check_in=2024-06-13&check_out=2024-06-18&source_impression_id=p3_1718221059_P3ZuAZzzp3_MIKka&previous_page_section_name=1000&federated_search_id=30f82058-a7f3-463c-9568-31e4c24d8d52,Surajit,https://www.airbnb.com/users/show/306056000,"Rating, 5 stars,  路 January 2024","Great place to stay, host is really good.",5 years on Airbnb
2,https://www.airbnb.com/rooms/51971503/reviews?adults=1&category_tag=Tag%3A8678&children=0&enable_m3_private_room=true&infants=0&pets=0&photo_id=1246300514&search_mode=regular_search&check_in=2024-06-13&check_out=2024-06-18&source_impression_id=p3_1718221059_P3ZuAZzzp3_MIKka&previous_page_section_name=1000&federated_search_id=30f82058-a7f3-463c-9568-31e4c24d8d52,Syeda Tasmia,https://www.airbnb.com/users/show/229521208,"Rating, 5 stars,  路 December 2023,  路 Stayed one night",Good experience. Beautiful home. We wish the host all the best.,"Dhaka, Bangladesh"
3,https://www.airbnb.com/rooms/51971503/reviews?adults=1&category_tag=Tag%3A8678&children=0&enable_m3_private_room=true&infants=0&pets=0&photo_id=1246300514&search_mode=regular_search&check_in=2024-06-13&check_out=2024-06-18&source_impression_id=p3_1718221059_P3ZuAZzzp3_MIKka&previous_page_section_name=1000&federated_search_id=30f82058-a7f3-463c-9568-31e4c24d8d52,Sazit Ul,https://www.airbnb.com/users/show/515993299,"Rating, 5 stars,  路 October 2023,  路 Stayed one night",Its is a great place to stay. Hands down.,1 year on Airbnb
4,https://www.airbnb.com/rooms/51971503/reviews?adults=1&category_tag=Tag%3A8678&children=0&enable_m3_private_room=true&infants=0&pets=0&photo_id=1246300514&search_mode=regular_search&check_in=2024-06-13&check_out=2024-06-18&source_impression_id=p3_1718221059_P3ZuAZzzp3_MIKka&previous_page_section_name=1000&federated_search_id=30f82058-a7f3-463c-9568-31e4c24d8d52,Md,https://www.airbnb.com/users/show/71855577,"Rating, 5 stars,  路 October 2023,  路 Stayed one night","Wonderful Host! Thanks to him for sharing his beautifully decorated place. Just little confused about what part of his place we can access, probably because of my weak communication skill. My son liked the place very much, especially the roof top. I will recommend this place to anyone without any doubt.","Dhaka, Bangladesh"
5,https://www.airbnb.com/rooms/51971503/reviews?adults=1&category_tag=Tag%3A8678&children=0&enable_m3_private_room=true&infants=0&pets=0&photo_id=1246300514&search_mode=regular_search&check_in=2024-06-13&check_out=2024-06-18&source_impression_id=p3_1718221059_P3ZuAZzzp3_MIKka&previous_page_section_name=1000&federated_search_id=30f82058-a7f3-463c-9568-31e4c24d8d52,Mahadi,https://www.airbnb.com/users/show/235398799,"Rating, 5 stars,  路 July 2023,  路 Stayed a few nights",Its a great place to stay in the city heart of of the Cumilla city.,5 years on Airbnb
6,https://www.airbnb.com/rooms/51971503/reviews?adults=1&category_tag=Tag%3A8678&children=0&enable_m3_private_room=true&infants=0&pets=0&photo_id=1246300514&search_mode=regular_search&check_in=2024-06-13&check_out=2024-06-18&source_impression_id=p3_1718221059_P3ZuAZzzp3_MIKka&previous_page_section_name=1000&federated_search_id=30f82058-a7f3-463c-9568-31e4c24d8d52,Rayhan,https://www.airbnb.com/users/show/487227975,"Rating, 5 stars,  路 June 2023,  路 Stayed a few nights","I recently stayed at this Airbnb and it was a wonderful experience. The place was very nice and beautiful, with an especially stunning view from the balcony. The antique collections throughout the apartment made it feel like I was visiting a resourceful museum. I particularly enjoyed the collection of cameras. Mr. Palash was a culturally minded man and it was evident in the paintings and collection throughout the apartment.
The location was easy to find and located at the heart of the town, yet it was quiet. Although I only booked for two days, I had a commitment to attend, so I didn't stay on the second night. Mr. Palash was very helpful, accommodating and kind about my needs.
Overall, I strongly recommend this place to anyone looking for a comfortable and enjoyable stay in this town.",2 years on Airbnb
7,https://www.airbnb.com/rooms/51971503/reviews?adults=1&category_tag=Tag%3A8678&children=0&enable_m3_private_room=true&infants=0&pets=0&photo_id=1246300514&search_mode=regular_search&check_in=2024-06-13&check_out=2024-06-18&source_impression_id=p3_1718221059_P3ZuAZzzp3_MIKka&previous_page_section_name=1000&federated_search_id=30f82058-a7f3-463c-9568-31e4c24d8d52,Aftab,https://www.airbnb.com/users/show/513083175,"Rating, 5 stars,  路 May 2023,  路 Stayed one night",it was a beautiful place and the host is an amazing person,1 year on Airbnb
8,https://www.airbnb.com/rooms/51971503/reviews?adults=1&category_tag=Tag%3A8678&children=0&enable_m3_private_room=true&infants=0&pets=0&photo_id=1246300514&search_mode=regular_search&check_in=2024-06-13&check_out=2024-06-18&source_impression_id=p3_1718221059_P3ZuAZzzp3_MIKka&previous_page_section_name=1000&federated_search_id=30f82058-a7f3-463c-9568-31e4c24d8d52,Monjurul Akib,https://www.airbnb.com/users/show/303171608,"Rating, 5 stars,  路 March 2023,  路 Stayed a few nights","He is really an Amazing host.Always responsive, friendly and helpful.
Thanks Mr Monjurul Azim for being a lovely host.Hope to see you again soon.",5 years on Airbnb
9,https://www.airbnb.com/rooms/51971503/reviews?adults=1&category_tag=Tag%3A8678&children=0&enable_m3_private_room=true&infants=0&pets=0&photo_id=1246300514&search_mode=regular_search&check_in=2024-06-13&check_out=2024-06-18&source_impression_id=p3_1718221059_P3ZuAZzzp3_MIKka&previous_page_section_name=1000&federated_search_id=30f82058-a7f3-463c-9568-31e4c24d8d52,Md Atiqur,https://www.airbnb.com/users/show/476344975,"Rating, 5 stars,  路 February 2023,  路 Stayed one night","Mr. Palash has observed the world very keenly. This home is a reflection of his thoughts, lifelong experiences and accumulated knowledge. It is so well decorated. It is as if he knew every brick beforehand.",2 years on Airbnb
10,https://www.airbnb.com/rooms/51971503/reviews?adults=1&category_tag=Tag%3A8678&children=0&enable_m3_private_room=true&infants=0&pets=0&photo_id=1246300514&search_mode=regular_search&check_in=2024-06-13&check_out=2024-06-18&source_impression_id=p3_1718221059_P3ZuAZzzp3_MIKka&previous_page_section_name=1000&federated_search_id=30f82058-a7f3-463c-9568-31e4c24d8d52,Shams,https://www.airbnb.com/users/show/181421626,"Rating, 5 stars,  路 January 2023,  路 Stayed a few nights","Well, This place in Comilla is unbelievable! It's better than the pictures in real! Aesthetics indoor, Full uninterrupted view of Comilla's pride Dhormosagor par & the stadium makes this place desirable to stay. an example of cool amazing place in Comilla & it was a delight to speak to host Polash bhai, during my stay, Who treated me yummy Singaras everyday",6 years on Airbnb
11,https://www.airbnb.com/rooms/51971503/reviews?adults=1&category_tag=Tag%3A8678&children=0&enable_m3_private_room=true&infants=0&pets=0&photo_id=1246300514&search_mode=regular_search&check_in=2024-06-13&check_out=2024-06-18&source_impression_id=p3_1718221059_P3ZuAZzzp3_MIKka&previous_page_section_name=1000&federated_search_id=30f82058-a7f3-463c-9568-31e4c24d8d52,Tanvir,https://www.airbnb.com/users/show/54801394,"Rating, 5 stars,  路 January 2023,  路 Stayed about a week","Mr. Azim is an amazing host. Everything that you look for in a host. He is friendly, knowledgeable, helpful, available, clean and organized. The place looks exactly the same as in the pictures. The location is right in the heart of the town. Easy access to all that it has to offer. Beautiful views of the town from the apartment and also from the rooftop. The host will be able to answer your inquiries and offer helpful tips. I will definitely stay here when I am back in town again. Thank you!!","Garden City, New York"
12,https://www.airbnb.com/rooms/51971503/reviews?adults=1&category_tag=Tag%3A8678&children=0&enable_m3_private_room=true&infants=0&pets=0&photo_id=1246300514&search_mode=regular_search&check_in=2024-06-13&check_out=2024-06-18&source_impression_id=p3_1718221059_P3ZuAZzzp3_MIKka&previous_page_section_name=1000&federated_search_id=30f82058-a7f3-463c-9568-31e4c24d8d52,Sobhani,https://www.airbnb.com/users/show/488342765,"Rating, 5 stars,  路 November 2022,  路 Stayed one night",Very beautiful home and the owners are really nice & welcoming.,2 years on Airbnb
13,https://www.airbnb.com/rooms/51971503/reviews?adults=1&category_tag=Tag%3A8678&children=0&enable_m3_private_room=true&infants=0&pets=0&photo_id=1246300514&search_mode=regular_search&check_in=2024-06-13&check_out=2024-06-18&source_impression_id=p3_1718221059_P3ZuAZzzp3_MIKka&previous_page_section_name=1000&federated_search_id=30f82058-a7f3-463c-9568-31e4c24d8d52,Md,https://www.airbnb.com/users/show/71855577,"Rating, 5 stars,  路 May 2022,  路 Stayed one night",Highly recommended,6 years on Airbnb
14,https://www.airbnb.com/rooms/51971503/reviews?adults=1&category_tag=Tag%3A8678&children=0&enable_m3_private_room=true&infants=0&pets=0&photo_id=1246300514&search_mode=regular_search&check_in=2024-06-13&check_out=2024-06-18&source_impression_id=p3_1718221059_P3ZuAZzzp3_MIKka&previous_page_section_name=1000&federated_search_id=30f82058-a7f3-463c-9568-31e4c24d8d52,Mahlil,https://www.airbnb.com/users/show/434738483,"Rating, 5 stars,  路 January 2022,  路 Stayed one night","The Host, Mr. Palash, was really friendly. The place is nice, very well decorated. Just like the pictures, the apartments got a really nice view to look at. Privacy as well was good enough for being an open duplex apartment. Everything was clean and we had a good time there. Definitely want to visit again sometime.",3 years on Airbnb
15,https://www.airbnb.com/rooms/51971503/reviews?adults=1&category_tag=Tag%3A8678&children=0&enable_m3_private_room=true&infants=0&pets=0&photo_id=1246300514&search_mode=regular_search&check_in=2024-06-13&check_out=2024-06-18&source_impression_id=p3_1718221059_P3ZuAZzzp3_MIKka&previous_page_section_name=1000&federated_search_id=30f82058-a7f3-463c-9568-31e4c24d8d52,Humaid,https://www.airbnb.com/users/show/431660178,"Rating, 5 stars,  路 December 2021,  路 Stayed a few nights","A very spacious and cozy place with impeccable cleanliness maintained by the owner.
Mr. Monjurul was also very kind and fun to chat with, looking forward to staying there again.","Jeddah, Saudi Arabia"
16,https://www.airbnb.com/rooms/51971503/reviews?adults=1&category_tag=Tag%3A8678&children=0&enable_m3_private_room=true&infants=0&pets=0&photo_id=1246300514&search_mode=regular_search&check_in=2024-06-13&check_out=2024-06-18&source_impression_id=p3_1718221059_P3ZuAZzzp3_MIKka&previous_page_section_name=1000&federated_search_id=30f82058-a7f3-463c-9568-31e4c24d8d52,Piash,https://www.airbnb.com/users/show/275746046,"Rating, 5 stars,  路 September 2021,  路 Stayed one night","It's a very nice and homely place to stay.
Though It's a open apartment, privacy was so good..the view of the DSP from the apartment was really amazing.the apartment was neat and clean. Finally the host was super friendly.",5 years on Airbnb
