,review_link,reviewer_name,reviewer_profile_link,info,rating_comment,rating_extra
0,https://www.airbnb.com/rooms/53986579/reviews?adults=1&children=0&enable_m3_private_room=true&infants=0&pets=0&search_mode=regular_search&check_in=2024-06-13&check_out=2024-06-18&source_impression_id=p3_1718221353_P3vlg_OUKeYkp0GZ&previous_page_section_name=1000&federated_search_id=324092a6-1bfc-4043-8042-e9e2e51db260,Sheikh Kaushik,https://www.airbnb.com/users/show/483359840,"Rating, 5 stars,  · March 2024,  · Stayed about a week","It was a fantastic place to stay. Mrs. Nigar is a wonderful host. Her behaviour and attitude was 5 out of 5. The location is ideal for moving both in new and old Dhaka. Considering the price, the home is a great deal. Hopefully a water filter and a washing machine will be established soon. My best wishes!",2 years on Airbnb
1,https://www.airbnb.com/rooms/53986579/reviews?adults=1&children=0&enable_m3_private_room=true&infants=0&pets=0&search_mode=regular_search&check_in=2024-06-13&check_out=2024-06-18&source_impression_id=p3_1718221353_P3vlg_OUKeYkp0GZ&previous_page_section_name=1000&federated_search_id=324092a6-1bfc-4043-8042-e9e2e51db260,Mohammad,https://www.airbnb.com/users/show/210458113,"Rating, 5 stars,  · November 2023",Good place to stay with family at a reasonable price.,6 years on Airbnb
2,https://www.airbnb.com/rooms/53986579/reviews?adults=1&children=0&enable_m3_private_room=true&infants=0&pets=0&search_mode=regular_search&check_in=2024-06-13&check_out=2024-06-18&source_impression_id=p3_1718221353_P3vlg_OUKeYkp0GZ&previous_page_section_name=1000&federated_search_id=324092a6-1bfc-4043-8042-e9e2e51db260,Mohammad Zahir,https://www.airbnb.com/users/show/543365808,"Rating, 5 stars,  · November 2023",Nice and clean place. Nigar was helpful and responsive.,7 months on Airbnb
3,https://www.airbnb.com/rooms/53986579/reviews?adults=1&children=0&enable_m3_private_room=true&infants=0&pets=0&search_mode=regular_search&check_in=2024-06-13&check_out=2024-06-18&source_impression_id=p3_1718221353_P3vlg_OUKeYkp0GZ&previous_page_section_name=1000&federated_search_id=324092a6-1bfc-4043-8042-e9e2e51db260,Mugniul,https://www.airbnb.com/users/show/541893238,"Rating, 5 stars,  · October 2023,  · Stayed a few nights",It was very amazing and comfortable place to stay. All the Daily accessories that people need are provided here. Highly Recommended to stay.,"Chattogram, Bangladesh"
4,https://www.airbnb.com/rooms/53986579/reviews?adults=1&children=0&enable_m3_private_room=true&infants=0&pets=0&search_mode=regular_search&check_in=2024-06-13&check_out=2024-06-18&source_impression_id=p3_1718221353_P3vlg_OUKeYkp0GZ&previous_page_section_name=1000&federated_search_id=324092a6-1bfc-4043-8042-e9e2e51db260,Tarik,https://www.airbnb.com/users/show/206850960,"Rating, 5 stars,  · July 2023,  · Stayed a few nights",Great location. Apartment was just as described. The host were very friendly and lovely. Would definitely stay again,6 years on Airbnb
5,https://www.airbnb.com/rooms/53986579/reviews?adults=1&children=0&enable_m3_private_room=true&infants=0&pets=0&search_mode=regular_search&check_in=2024-06-13&check_out=2024-06-18&source_impression_id=p3_1718221353_P3vlg_OUKeYkp0GZ&previous_page_section_name=1000&federated_search_id=324092a6-1bfc-4043-8042-e9e2e51db260,Zobair,https://www.airbnb.com/users/show/278681170,"Rating, 5 stars,  · August 2022,  · Stayed a few nights",Rooms were big and clean. Very well furnished and decorated for a place meant to be on Airbnb. The host was also super friendly and helpful. Building seems very secure,"Columbus, Ohio"
6,https://www.airbnb.com/rooms/53986579/reviews?adults=1&children=0&enable_m3_private_room=true&infants=0&pets=0&search_mode=regular_search&check_in=2024-06-13&check_out=2024-06-18&source_impression_id=p3_1718221353_P3vlg_OUKeYkp0GZ&previous_page_section_name=1000&federated_search_id=324092a6-1bfc-4043-8042-e9e2e51db260,Sakibur,https://www.airbnb.com/users/show/446217700,"Rating, 5 stars,  · March 2022",A place for perfect family time.,2 years on Airbnb
