,review_link,reviewer_name,reviewer_profile_link,info,rating_comment,rating_extra
0,https://www.airbnb.com/rooms/818806599820750505/reviews?adults=1&children=0&enable_m3_private_room=true&infants=0&pets=0&search_mode=regular_search&check_in=2024-06-14&check_out=2024-06-19&source_impression_id=p3_1718223372_P3F5mPfgJ_XdeV6c&previous_page_section_name=1000&federated_search_id=00722332-c005-4f37-ac93-b8b8707a0422,Al Amin,https://www.airbnb.com/users/show/91311388,"Rating, 5 stars,  · June 2023,  · Stayed about a week","An fantastic stay in a fantastic Airbnb place to stay!
I had the pleasure of booking an Airbnb stay recently and I have to say it was an absolutely great experience! From start to finish, I felt at home and was able to experience the true essence of hospitality.
Communication with host Mr. Arif was excellent. Even before my arrival, I was warmly welcomed and received all the necessary information. Questions were answered promptly and the host was always available to clarify my concerns.
The place itself was just stunning. It was exactly as it was presented in the photos - clean, stylish and cozy.
The highlight of my stay was undoubtedly the hospitality of the host. Mr. Arifäußter friendly, attentive and helpful. I will definitely come back.
Thank you Mr. Arif",8 years on Airbnb
1,https://www.airbnb.com/rooms/818806599820750505/reviews?adults=1&children=0&enable_m3_private_room=true&infants=0&pets=0&search_mode=regular_search&check_in=2024-06-14&check_out=2024-06-19&source_impression_id=p3_1718223372_P3F5mPfgJ_XdeV6c&previous_page_section_name=1000&federated_search_id=00722332-c005-4f37-ac93-b8b8707a0422,Al-Amin,https://www.airbnb.com/users/show/389139706,"Rating, 5 stars,  · February 2023,  · Stayed about a week",This place is worth to stay with peaceful and positive surroundings. Good stay for people who are traveling abroad since airports are nearby. Mr. Arif communicated very well And his friendly instructions made that place home.,3 years on Airbnb
