,review_link,reviewer_name,reviewer_profile_link,info,rating_comment,rating_extra
0,https://www.airbnb.com/rooms/1008462912568683510/reviews?adults=1&children=0&enable_m3_private_room=true&infants=0&pets=0&search_mode=regular_search&check_in=2024-06-13&check_out=2024-06-18&source_impression_id=p3_1718221366_P3caNNi_YpFL0FUq&previous_page_section_name=1000&federated_search_id=49992ff4-c10b-4011-b09b-9196abc6f9be,Mahbubur,https://www.airbnb.com/users/show/153918738,"Rating, 5 stars,  · February 2024,  · Group trip","⭐️⭐️⭐️⭐️⭐️
We had an incredible stay at this Airbnb! The home is beautifully decorated with modern appliances, creating a cozy and stylish atmosphere. The spacious layout was perfect for our group, providing plenty of room to relax and unwind.
Additionally, the host was incredibly helpful and accommodating throughout our stay. They went above and beyond to ensure we had everything we needed, from local recommendations to prompt responses to any questions we had.
Overall, we highly recommend this Airbnb to anyone looking for a comfortable and enjoyable stay. We can't wait to come back!","New York, United States"
1,https://www.airbnb.com/rooms/1008462912568683510/reviews?adults=1&children=0&enable_m3_private_room=true&infants=0&pets=0&search_mode=regular_search&check_in=2024-06-13&check_out=2024-06-18&source_impression_id=p3_1718221366_P3caNNi_YpFL0FUq&previous_page_section_name=1000&federated_search_id=49992ff4-c10b-4011-b09b-9196abc6f9be,Mohammad,https://www.airbnb.com/users/show/166262789,"Rating, 5 stars,  · December 2023",Very friendly and helpful. The apartment is very nice to enjoy the holidays.,6 years on Airbnb
