,review_link,reviewer_name,reviewer_profile_link,info,rating_comment,rating_extra
0,https://www.airbnb.com/rooms/1133155598402098593/reviews?adults=1&children=0&enable_m3_private_room=true&infants=0&pets=0&search_mode=regular_search&check_in=2024-06-13&check_out=2024-06-18&source_impression_id=p3_1718221346_P3xKWEQ-TvKr-MWc&previous_page_section_name=1000&federated_search_id=f082d25a-d628-454c-be43-d29b6a921b9e,Akib,https://www.airbnb.com/users/show/473736596,"Rating, 5 stars,  路 2 weeks ago,  路 Stayed one night","It was a very nice experience. Apu and her husband both were very helpful. Check in was easy. Everything was super clean. Their furniture choice is great which makes the place look awesome. The kitchen had everything, we even cooked. The living room had a comfortable space, we hanged out and watched tv.
Everything was great. I highly recommend this place. Definitely would be my first choise if I am around town and wanna visit again. 火",2 years on Airbnb
1,https://www.airbnb.com/rooms/1133155598402098593/reviews?adults=1&children=0&enable_m3_private_room=true&infants=0&pets=0&search_mode=regular_search&check_in=2024-06-13&check_out=2024-06-18&source_impression_id=p3_1718221346_P3xKWEQ-TvKr-MWc&previous_page_section_name=1000&federated_search_id=f082d25a-d628-454c-be43-d29b6a921b9e,Reyad,https://www.airbnb.com/users/show/110092219,"Rating, 5 stars,  路 2 weeks ago,  路 Stayed one night",Nafisa Apus place was more than perfect and entire flat was available as she described. She & her husband were very much responsive from booking the place to recieving us and through out the checkin and checkout time. The entire flat is furnished and amenities are perfectly available. The kitchens and washrooms were equipped with necessary items need for cooking or taking shower. Has two separate balconies to spend time alone and smoke. Its a quite place to have some me time. Very much recommended and looking forward to stay again. Thank you very much to both Nafisa Apu & her husband. Love А,"Dhaka, Bangladesh"
2,https://www.airbnb.com/rooms/1133155598402098593/reviews?adults=1&children=0&enable_m3_private_room=true&infants=0&pets=0&search_mode=regular_search&check_in=2024-06-13&check_out=2024-06-18&source_impression_id=p3_1718221346_P3xKWEQ-TvKr-MWc&previous_page_section_name=1000&federated_search_id=f082d25a-d628-454c-be43-d29b6a921b9e,Nazmul,https://www.airbnb.com/users/show/487851380,"Rating, 5 stars,  路 May 2024,  路 Stayed with kids",We stayed for 2 nights. Found the host responsive and helpful. The place was nice.,2 years on Airbnb
3,https://www.airbnb.com/rooms/1133155598402098593/reviews?adults=1&children=0&enable_m3_private_room=true&infants=0&pets=0&search_mode=regular_search&check_in=2024-06-13&check_out=2024-06-18&source_impression_id=p3_1718221346_P3xKWEQ-TvKr-MWc&previous_page_section_name=1000&federated_search_id=f082d25a-d628-454c-be43-d29b6a921b9e,Paul,https://www.airbnb.com/users/show/30604523,"Rating, 4 stars,  路 May 2024,  路 Stayed a few nights",I had a comfortable stay and the host was very communicative. One feedback - the host should provide two sheets for each bed.,9 years on Airbnb
4,https://www.airbnb.com/rooms/1133155598402098593/reviews?adults=1&children=0&enable_m3_private_room=true&infants=0&pets=0&search_mode=regular_search&check_in=2024-06-13&check_out=2024-06-18&source_impression_id=p3_1718221346_P3xKWEQ-TvKr-MWc&previous_page_section_name=1000&federated_search_id=f082d25a-d628-454c-be43-d29b6a921b9e,Milton,https://www.airbnb.com/users/show/426329666,"Rating, 5 stars,  路 April 2024,  路 Stayed one night",Great place to stay. The host & his brother was too nice. I took the option of Early Check-in. To my utter surprise it went like a smooth butter under a hot knife. Highly Recommended,3 years on Airbnb
